context_before,equation,context_after,spoken_English,latex_num_expressions,latex_total_length,latex_total_commands,latex_total_nesting_depth,latex_total_subscripts,latex_total_superscripts,latex_total_braces,latex_avg_complexity_score,latex_total_operators,pca_1,pca_2
: the reflection coefficient,$ R $,for a wave packet is greater than one . This would indicate that at the boundary of regions with strong electric fields photon beams could be produced . There is,R,1,3,0,0,0,0,0,0.30000000000000004,0,-1.5320667200554465,-0.01481389381748181
vertices of,$ U $,are used to complete,U,1,3,0,0,0,0,0,0.30000000000000004,0,-1.5320667200554465,-0.01481389381748181
em,"$ \sO_ { X_s , x } $",is Cohen-Macaulay ; and,oh sub X sub s comma x,1,18,1,1,2,0,2,7.3,0,2.7021202307258267,0.24317085055715468
and,$ |\mathrm { par } ( B_ { j ' } ) | > 1 $,". Then , since both have",Absolute value of the symbol 'p' of symbol 'B sub j' is greater than one.,1,39,1,1,1,0,4,8.9,1,4.311926467415169,0.04348537908721594
because the constant in front of the powers of,$ \lambda $,depends on,Lambda.,1,9,1,0,0,0,0,2.4,0,-0.6363572682091074,0.001231207400264684
is smoothly immersed and embedded into,$ { \mathbb { R } } ^6 $,. This argument is also presented in a more general manner in,the set of real numbers raised to the power of six.,1,22,1,2,0,1,4,8.7,0,4.291133464142779,0.2584490296940797
links whose rotation numbers and corresponding,$ d_3 $,-invariants,d sub 3,1,5,0,0,1,0,0,1.5,0,-0.8545567731059536,-0.008993867909922706
is transverse to,$ F $,at,F,1,3,0,0,0,0,0,0.30000000000000004,0,-1.5320667200554465,-0.01481389381748181
is the variance of the latent distribution for the,$ j^ { th } $,dimension and,j to the power of th.,1,11,0,1,0,1,2,4.1,0,1.4119664072604905,0.012104337134561435
,"$ L_ { f , M } = \lambda_ { \max } ( M^ { -1 } A ) $",and,"L subscript f, M equals lambda subscript max open parenthesis M to the power of negative one A close parenthesis.",1,50,2,1,2,1,6,14.0,2,7.904885903888474,-0.3357128472369029
independent of the one-dimensional Brownian motion,$ W $,with jump times,W,1,3,0,0,0,0,0,0.30000000000000004,0,-1.5320667200554465,-0.01481389381748181
We remark here that it is not a notational infelicity that we reuse here the letters,$ \phi $,and,phi.,1,6,1,0,0,0,0,2.1,0,-0.796550964066675,0.0007333968571364458
given as the unique factor of,$ \csk ( - ) ^ { \shape } : \csk X \to \csk \shape X $,". We will show that this map is an equivalence . Since it is crisp , it suffices to show that it is an equivalence on","Cosine of negative one raised to the power of shape, colon, cosine of X, arrow, cosine of k shape X.",1,52,6,1,0,1,2,13.2,1,6.878658406805583,-0.17861025900821004
are respective ordered Laplacian spectrum of,$ \Gamma $,and,Gamma.,1,8,1,0,0,0,0,2.3,0,-0.6897551668282966,0.001065270552555276
&,$ A $,&,A,1,3,0,0,0,0,0,0.30000000000000004,0,-1.5320667200554465,-0.01481389381748181
Let,$ \mathcal { O } $,be an open subset of,script O.,1,16,1,1,0,0,2,5.1,0,1.4538961340652197,0.23186267243745526
the sets grow and the size of a minimum,"$ ( S , T ) $",-separator increases accordingly . The size of a minimum,S comma T.,1,11,0,0,0,0,0,1.1,0,-1.104883531101933,-0.013486399035806503
-dimensional complex vector space,$ \mathbb { C } ^d $,as,C to the power of d.,1,18,1,1,0,1,2,6.3,0,2.3610737577260186,0.02831537520001734
,$ M $,"is the unique matrix with such property . Therefore , together with Theorem~",M,1,3,0,0,0,0,0,0.30000000000000004,0,-1.5320667200554465,-0.01481389381748181
will have decayed away long before,$ N_1 $,"decays , as a consequence of their larger Yukawa couplings needed to explain the observed neutrino masses . Further we assume there is no primordial lepton asymmetry",N sub 1.,1,5,0,0,1,0,0,1.5,0,-0.8545567731059536,-0.008993867909922706
0 mounted on UAV &,$ \checkmark $,&,Checkmark.,1,12,1,0,0,0,0,2.7,0,-0.47616357235153983,0.0017290179433929222
is a synthetic corruption drawn from,$ \mathcal { P } $,"as well , as shown in Fig .",P in calligraphic font.,1,16,1,1,0,0,2,5.1,0,1.4538961340652197,0.23186267243745526
the threshold,$ \eta_a $,"is 58 , which far exceeds the threshold . Therefore , the threshold condition is only appropriate for the pump with uniform polarization . Once there is polarization distribution in",eta sub a.,1,8,1,0,1,0,0,3.3,0,-0.11904101711718226,0.006553422764695557
of,$ f $,over any geometric point of,f,1,3,0,0,0,0,0,0.30000000000000004,0,-1.5320667200554465,-0.01481389381748181
For any space,$ X $,consider the simplicial category,X,1,3,0,0,0,0,0,0.30000000000000004,0,-1.5320667200554465,-0.01481389381748181
is the diagonal matrix whose,$ i $,th entry is given by,i,1,3,0,0,0,0,0,0.30000000000000004,0,-1.5320667200554465,-0.01481389381748181
The state of the thermodynamic system is described by a set of mechanical state variables,"$ ( \mathbf { q } , \mathbf { v } ) $",and thermodynamic variables,"math bold q, math bold v",1,35,2,1,0,0,4,7.0,0,3.4618186411729246,0.33169074668398296
and define the two-sided random walks,$ ( X_n ) _ { n\in \Z } $,and,"Open parenthesis, X sub n, close parenthesis, sub n belongs to the set of integers.",1,23,2,1,2,0,2,9.3,0,3.5444317839529766,0.2590500149271918
converges to,$ x^ * $,uniformly in,x raised to the power of asterisk.,1,6,0,0,0,1,0,2.1,1,-0.1342866422934977,-0.4996298164303508
and the partially filled circles indicate the progressive evolution from time,$ \tilde { t } _n $,to,t tilde sub n.,1,17,1,1,1,0,2,6.2,0,2.0780081823955237,0.23751676149730494
and accuracy,$ \eps $,:,epsilon.,1,6,1,0,0,0,0,2.1,0,-0.796550964066675,0.0007333968571364458
for all,$ z \in Z $,", and hence",z belongs to the set of integers.,1,9,1,0,0,0,0,2.4,0,-0.6363572682091074,0.001231207400264684
we required a set of different solutions - since each solution has a different,$ \rho_c $,"value , we needed many solutions to approximate the minimal",rho sub c.,1,8,1,0,1,0,0,3.3,0,-0.11904101711718226,0.006553422764695557
yielded single-electron,$ E1 $,matrix elements for high-,E1: None,1,4,0,0,0,0,0,0.4,0,-1.4786688214362573,-0.014647956969772401
and,$ b $,whenever,b,1,3,0,0,0,0,0,0.30000000000000004,0,-1.5320667200554465,-0.01481389381748181
and choosing~,$ \eps \ll 1 $,sufficiently small such that the series on the righthand side of~,epsilon much less than one.,1,12,2,0,0,0,0,4.2,0,0.0991584877796639,0.016778498074882946
The,$ S $,of the observed image is shown as the rightmost data point for each panel . },S,1,3,0,0,0,0,0,0.30000000000000004,0,-1.5320667200554465,-0.01481389381748181
The fidelities of the two reconstructed atom-photon states in dependence of the maximum number of trials,$ n_\textrm { max } $,are plotted in,n sub max,1,19,1,1,1,0,2,6.4,0,2.184803979633902,0.23784863519272378
,$ outputs $,,outputs.,1,9,0,0,0,0,0,0.9,0,-1.2116793283403113,-0.013818272731225333
and,$ \gamma^\star $,is multiplied by the quadratic term,Gamma star.,1,14,2,0,0,1,0,5.4,0,1.006336111440463,-0.18676879916255495
The encoded text embedding,$ \mathbf { c } $,is extracted by a Clip-text Encoder,c,1,15,1,1,0,0,2,5.0,0,1.4004982354460305,0.23169673558974585
Alice and Bob determine the number,$ N $,"of total rounds , the acceptance probability function",N,1,3,0,0,0,0,0,0.30000000000000004,0,-1.5320667200554465,-0.01481389381748181
for the rightmost BS and,$ \phi=0 $,for the rightmost PS . As is explained in more detail in,phi equals zero.,1,8,1,0,0,0,0,2.8,1,-0.2525506113463358,-0.2803692916705853
we can know that it is unstable since,$ ( \beta-\alpha ) u > 0 $,. For,"Open parenthesis, beta minus alpha, close parenthesis, u, greater than zero.",1,24,2,0,0,0,0,6.4,2,1.6143423821738563,-0.5440993841988853
and the non-zero temperature gradient is described by the deviation of,$ T_b $,from,T sub b.,1,5,0,0,1,0,0,1.5,0,-0.8545567731059536,-0.008993867909922706
is generically,$ \tau $,-reduced . It is well known that,Tau.,1,6,1,0,0,0,0,2.1,0,-0.796550964066675,0.0007333968571364458
When,$ \omega $,"is sufficiently small ,",omega.,1,8,1,0,0,0,0,2.3,0,-0.6897551668282966,0.001065270552555276
with impact parameter,$ b < 0.9 $,. Transit parameters were drawn from,b less than 0.9,1,9,0,0,0,0,0,1.4,1,-0.7744747728583504,-0.2952528349543659
with a scaling constant,$ C_\rho $,. Then we can easily find that small,C sub rho.,1,8,1,0,1,0,0,3.3,0,-0.11904101711718226,0.006553422764695557
Let,$ \mathcal { T } = \Torsoid { H } $,be a cyclic torsoid in,The T is equal to the closure of H.,1,33,2,1,0,0,4,8.8,1,3.9961469861201238,0.05205108592030926
it learns accurate,$ Q $,"-values for the part of that is state space that is visited by the deceptive policy , leading to an effective pruning procedure . Therefore it reliably reaches the real",Q,1,3,0,0,0,0,0,0.30000000000000004,0,-1.5320667200554465,-0.01481389381748181
HitRatio @,$ 10 $,scores one if the positive sample is in the top 10 and zero otherwise . The scores are then averaged for all interactions . MRR @,Ten.,1,4,0,0,0,0,0,0.4,0,-1.4786688214362573,-0.014647956969772401
&,$ \mathbf { e } _i $,& The,e sub i.,1,18,1,1,1,0,2,6.3,0,2.131406081014713,0.23768269834501438
We can immediately see that the parameter,$ k $,in our simple combinatorial calculation in,k,1,3,0,0,0,0,0,0.30000000000000004,0,-1.5320667200554465,-0.01481389381748181
are not arbitrary and must satisfy the symmetry requirements of the vector field around,$ \textbf { k } _0 $,",",k sub zero,1,18,1,1,1,0,2,6.3,0,2.131406081014713,0.23768269834501438
em For a process,$ \pi $,"at line 8 , if",pi.,1,5,1,0,0,0,0,2.0,0,-0.8499488626858642,0.0005674600094270377
is exactly the quotient of,$ \tilde { N } $,by the kernel,N tilde.,1,14,1,1,0,0,2,4.9,0,1.3471003368268413,0.23153079874203641
the discrete operators with subscript,$ 1 $,"denotes operations on the primal mesh , while subscript",one,1,3,0,0,0,0,0,0.30000000000000004,0,-1.5320667200554465,-0.01481389381748181
orthogonal matrix,$ A $,taking,A,1,3,0,0,0,0,0,0.30000000000000004,0,-1.5320667200554465,-0.01481389381748181
CRDI-CRDI and CRDI-CADI adjusted with,$ \epsilon =0.001 $,for,epsilon equals zero point zero zero one.,1,17,1,0,0,0,0,3.7,1,0.228030476226367,-0.2788758600412006
,$ } \bigskip \bigskip For $,k,bigksip for,1,25,2,0,0,0,1,4.0,0,0.9003915630832684,0.05868518652194192
when,$ T $,is large . Below is a picture which basically combines the previous mapping torus cobordism picture with this kind of neck lengthening but we 've flipped everything over ( because,T,1,3,0,0,0,0,0,0.30000000000000004,0,-1.5320667200554465,-0.01481389381748181
_2,$ CoH $,_8,coh,1,5,0,0,0,0,0,0.5,0,-1.4252709228170681,-0.014482020122062993
on,$ \R^6 $,. Define,R to the power of 6: None,1,6,1,0,0,1,0,3.1,0,0.003830862355745329,-0.20314577407572026
For all,$ k \in \N $,",",k belongs to the set of natural numbers.,1,10,2,0,0,0,0,4.0,0,-0.007637309458714475,0.016446624379464116
A graph,$ G $,is {,G,1,3,0,0,0,0,0,0.30000000000000004,0,-1.5320667200554465,-0.01481389381748181
% Since,$ X $,"is compact , an element",X,1,3,0,0,0,0,0,0.30000000000000004,0,-1.5320667200554465,-0.01481389381748181
where,$ R $,is a relation and,R,1,3,0,0,0,0,0,0.30000000000000004,0,-1.5320667200554465,-0.01481389381748181
,$ k_f $,is the fermi momentum and,kf: None,1,5,0,0,1,0,0,1.5,0,-0.8545567731059536,-0.008993867909922706
refers to the modeled orbit evaluated on the location of the data points while the superscript,$ d $,"refers to the data measurements . Moreover ,",d,1,3,0,0,0,0,0,0.30000000000000004,0,-1.5320667200554465,-0.01481389381748181
&,$ 0.487 $,&,0.487: None,1,7,0,0,0,0,0,0.7000000000000001,0,-1.3184751255786897,-0.014150146426644163
may depend on,$ p $,". Finally , we employ the Burkholder-Davis-Gundy inequality to show that",p,1,3,0,0,0,0,0,0.30000000000000004,0,-1.5320667200554465,-0.01481389381748181
This proves the admissibility of,$ M $,.,M,1,3,0,0,0,0,0,0.30000000000000004,0,-1.5320667200554465,-0.01481389381748181
we show that,$ E $,is homeomorphic to the plane ( Subsection,E,1,3,0,0,0,0,0,0.30000000000000004,0,-1.5320667200554465,-0.01481389381748181
Let,$ p_t $,denote the density of,p sub t,1,5,0,0,1,0,0,1.5,0,-0.8545567731059536,-0.008993867909922706
,"$ , $",,comma,1,3,0,0,0,0,0,0.30000000000000004,0,-1.5320667200554465,-0.01481389381748181
and that converge pointwise to,$ 1_B $,", the indicator function of",One B.,1,5,0,0,1,0,0,1.5,0,-0.8545567731059536,-0.008993867909922706
~n/cm,$ ^ { 2 } $,/s . As proposed in References~,squared.,1,9,0,1,0,1,2,3.9,0,1.3051706100221119,0.011772463439142612
this comes from exact computation on the infinite tree-like graph combined with some perturbation from sending,$ Q_I $,to,Q sub I.,1,5,0,0,1,0,0,1.5,0,-0.8545567731059536,-0.008993867909922706
The action is globally multiplied by,$ N $,", such that in the large",N,1,3,0,0,0,0,0,0.30000000000000004,0,-1.5320667200554465,-0.01481389381748181
and,$ \hat { \sigma } _0 ( t ) > 0 $,yields,Hat sigma sub zero of t is greater than zero.,1,30,2,1,1,0,2,9.5,1,3.7847074800581475,-0.02671114157412322
If,$ \epsilon $,"is too large , the constraint is loose , and we will filter out enormous valid actions . If",epsilon.,1,10,1,0,0,0,0,2.5,0,-0.5829593695899182,0.0013971442479740921
there is another node in,$ Q $,in the cluster of,Q,1,3,0,0,0,0,0,0.30000000000000004,0,-1.5320667200554465,-0.01481389381748181
equation where,$ \rho $,"is the gas density ,",rho.,1,6,1,0,0,0,0,2.1,0,-0.796550964066675,0.0007333968571364458
denotes the scalar curvature and,$ \varphi $,is the so-called phantom field because of the sign of its kinetic term . The EB solution can be expressed as,phi.,1,9,1,0,0,0,0,2.4,0,-0.6363572682091074,0.001231207400264684
&,$ - $,&,minus,1,3,0,0,0,0,0,0.8,1,-1.0948621645734855,-0.2962484560406224
the output current range of CLCS is configured to be 0 to,$ 5 $,,five,1,3,0,0,0,0,0,0.30000000000000004,0,-1.5320667200554465,-0.01481389381748181
,$ 1 $,",",one,1,3,0,0,0,0,0,0.30000000000000004,0,-1.5320667200554465,-0.01481389381748181
the set,$ W_j $,which contains,W sub j.,1,5,0,0,1,0,0,1.5,0,-0.8545567731059536,-0.008993867909922706
then mini pulses in the class,$ \kappa $,are not apparent . Thus the spectrum of class,kappa.,1,8,1,0,0,0,0,2.3,0,-0.6897551668282966,0.001065270552555276
,$ \Pp ( \Lambda_ { \bb } \text { is countable and dense in } \R ) = 1 $,.,P p ( Lambda sub b b is countable and dense in R ) equals 1,1,69,5,1,1,0,4,17.9,1,8.215151666515661,0.10866140504445841
,$ M $,"has a simple largest real eigenvalue , i.e . , the {",M,1,3,0,0,0,0,0,0.30000000000000004,0,-1.5320667200554465,-0.01481389381748181
Since,$ \Lambda $,and,Lambda.,1,9,1,0,0,0,0,2.4,0,-0.6363572682091074,0.001231207400264684
,$ G $,has a,G,1,3,0,0,0,0,0,0.30000000000000004,0,-1.5320667200554465,-0.01481389381748181
is the admissible ideal generated by,$ R $,. We identify the category of finitely generated right,R,1,3,0,0,0,0,0,0.30000000000000004,0,-1.5320667200554465,-0.01481389381748181
,$ 10^ { 5 } $,,Ten to the power of five.,1,11,0,1,0,1,2,4.1,0,1.4119664072604905,0.012104337134561435
The same effect of,$ \lambda $,on such radius is observed . For the limit,Lambda.,1,9,1,0,0,0,0,2.4,0,-0.6363572682091074,0.001231207400264684
and,$ \mathcal { F } _0 $,", are",F zero.,1,19,1,1,1,0,2,6.4,0,2.184803979633902,0.23784863519272378
be a root system of type,$ B_n $,",",B sub n.,1,5,0,0,1,0,0,1.5,0,-0.8545567731059536,-0.008993867909922706
is the range of the operator,$ T $,", and for",T,1,3,0,0,0,0,0,0.30000000000000004,0,-1.5320667200554465,-0.01481389381748181
because,"$ t\in [ 0 , s ] $",so the content is within the filtration,t belongs to the interval from 0 to s.,1,16,1,0,0,0,0,3.1,0,-0.2625719778747831,0.0023927653342305684
for each,$ v $,", we may choose all the",v,1,3,0,0,0,0,0,0.30000000000000004,0,-1.5320667200554465,-0.01481389381748181
-plane to the,$ c $,direction ( see Fig.~,c,1,3,0,0,0,0,0,0.30000000000000004,0,-1.5320667200554465,-0.01481389381748181
and,"$ \vec v= ( v_1 , \ldots , v_n ) $","are any two equal-length vectors of real numbers , then their","Vector v equals open parenthesis v sub 1, ellipsis, v sub n close parenthesis.",1,32,2,0,2,0,0,8.7,1,2.745749315067638,-0.2503610227697888
If,$ S\subseteq V ( G ) $,", we write",S is a subset of V of G.,1,20,1,0,0,0,0,3.5,0,-0.04898038339802622,0.0030565127250682146
7,$ ) stars clearly showed $,R_V,star sigma.,1,24,0,0,0,0,0,2.4000000000000004,0,-0.4107108490524732,-0.01132922001558417
We define the process of fine-tuning,$ G $,on OpenAI servers as a function (,G,1,3,0,0,0,0,0,0.30000000000000004,0,-1.5320667200554465,-0.01481389381748181
-dimensional ellipsoid,$ \mathcal { E } _r ( w ) $,with principal axes of length,E sub r of w,1,25,1,1,1,0,2,7.0,0,2.505191371349037,0.23884425627898026
and,$ \mu_u $,", while the other two parameters are kept at",mu sub u.,1,7,1,0,1,0,0,3.2,0,-0.17243891573637143,0.0063874859169861485
where,$ T ' $,is also a separator for,T prime.,1,5,0,0,0,0,0,0.5,0,-1.4252709228170681,-0.014482020122062993
in the crystal at that,$ T $,is close to zero . The averages of,T,1,3,0,0,0,0,0,0.30000000000000004,0,-1.5320667200554465,-0.01481389381748181
,$ & $,,and,1,3,0,0,0,0,0,0.30000000000000004,0,-1.5320667200554465,-0.01481389381748181
and,$ i $,bands with the FOV of,i,1,3,0,0,0,0,0,0.30000000000000004,0,-1.5320667200554465,-0.01481389381748181
1,$ & $,73.9,and,1,3,0,0,0,0,0,0.30000000000000004,0,-1.5320667200554465,-0.01481389381748181
and of,$ M $,) with higher accuracy in Section,M,1,3,0,0,0,0,0,0.30000000000000004,0,-1.5320667200554465,-0.01481389381748181
The inverse of,$ B_ { z } $,is now easily calculated :,B sub z.,1,10,0,1,1,0,2,4.0,0,1.1289008319299951,0.22130572343184904
restricted to each interval,"$ [ 1 , L ] $",", with",the interval from 1 to L.,1,11,0,0,0,0,0,1.1,0,-1.104883531101933,-0.013486399035806503
to obtain the final state,$ J ( T ) $,". In particular , we assume",J of T,1,9,0,0,0,0,0,0.9,0,-1.2116793283403113,-0.013818272731225333
or the port,$ b $,". We evaluate the probability of photons to exit at each port , and plot the results in Fig .",b,1,3,0,0,0,0,0,0.30000000000000004,0,-1.5320667200554465,-0.01481389381748181
We performed Monte Carlo simulations of,$ N_f=2+1 $,QCD at the physical point for five temperatures :,N sub f equals two plus one.,1,9,0,0,1,0,0,2.9,2,0.23344393233472494,-0.5711992449653662
,$ M_4 $,",",M sub 4.,1,5,0,0,1,0,0,1.5,0,-0.8545567731059536,-0.008993867909922706
such that denoting,$ \mu_j=\mu ( F_ { j } ) $,we have :,mu sub j equals mu of F sub j,1,24,2,1,2,0,2,8.4,1,3.8311146513505103,-0.02434538560312505
for an,$ n $,-simplex ( a hyperedge of,n,1,3,0,0,0,0,0,0.30000000000000004,0,-1.5320667200554465,-0.01481389381748181
when conditioned on,$ O_p $,and on,O sub p.,1,5,0,0,1,0,0,1.5,0,-0.8545567731059536,-0.008993867909922706
for the edge,$ uy $,", there exists a",u times y.,1,4,0,0,0,0,0,0.4,0,-1.4786688214362573,-0.014647956969772401
is not saturated by,$ \widetilde { M } $,for some,M tilde.,1,18,1,1,0,0,2,5.3,0,1.5606919313035978,0.23219454613287407
9\ ; GHz & 24\ ; GHz \\ \hline,$ M $,& Number of OFDM symbols & 64 & 64,M,1,3,0,0,0,0,0,0.30000000000000004,0,-1.5320667200554465,-0.01481389381748181
&,$ \Kal 532 $,& & &,Kal five three two,1,10,1,0,0,0,0,2.5,0,-0.5829593695899182,0.0013971442479740921
and,$ t_j \to \infty $,", then",Spoken: t sub j goes to infinity,1,16,2,0,1,0,0,5.6,0,0.8834642319675352,0.022930397677860873
For the continuity bounds the,$ \kappa $,"can , however , also depend on",kappa.,1,8,1,0,0,0,0,2.3,0,-0.6897551668282966,0.001065270552555276
that will be denote by,$ e $,. For any,e,1,3,0,0,0,0,0,0.30000000000000004,0,-1.5320667200554465,-0.01481389381748181
with,$ W $,a,W,1,3,0,0,0,0,0,0.30000000000000004,0,-1.5320667200554465,-0.01481389381748181
is the equivariant Euler class of the normal bundle %,$ \nu_p $,of,nu sub p.,1,7,1,0,1,0,0,3.2,0,-0.17243891573637143,0.0063874859169861485
and can be related to the primary domain via a,$ c $,-axis mirror . For,c,1,3,0,0,0,0,0,0.30000000000000004,0,-1.5320667200554465,-0.01481389381748181
neutrinos are always superluminal and antineutrinos will be superluminal for,$ n $,even . In this work we will focus on the cases,n,1,3,0,0,0,0,0,0.30000000000000004,0,-1.5320667200554465,-0.01481389381748181
for all,$ i\in [ n ] $,and non-increasing in,i belongs to the set of integers from 1 to n.,1,12,1,0,0,0,0,2.7,0,-0.47616357235153983,0.0017290179433929222
of class A samples display a blue square and,$ 30\ % $,"a red one , while for class B ,",Thirty percent.,1,7,0,0,0,0,0,0.7000000000000001,0,-1.3184751255786897,-0.014150146426644163
Recall that,$ \psi^\ell $,acts on,psi to the power of ell.,1,11,2,0,0,1,0,5.1,0,0.8461424155828952,-0.18726660970568318
,$ Q_x \neq Q_y $,.,Q sub x is not equal to Q sub y.,1,14,1,0,2,0,0,4.9,0,0.7720605243090676,0.013037196063092314
perfect knowledge for the channel,$ \mathbf { h } _m $,was assumed .,h sub m,1,18,1,1,1,0,2,6.3,0,2.131406081014713,0.23768269834501438
the dimension of,$ { \cal O } _f $,", formally given by",O sub f,1,15,1,1,1,0,2,6.0,0,1.9712123851571448,0.23718488780188612
forms a,$ \Pi_ { 2 } $,"-rule system . More generally , given a class",Pi sub 2.,1,12,1,1,1,0,2,5.7,0,1.8110186892995774,0.2366870772587579
2146,$ \pm $,0.0013,Plus or minus.,1,5,1,0,0,0,0,2.0,0,-0.8499488626858642,0.0005674600094270377
we attempted to substitute all extracted values of,$ x $,"and retained the reactions that could be successfully balanced . Competition metrics and free energies were assessed for each of the remaining reactions . For the enumerated competing reactions ,",x,1,3,0,0,0,0,0,0.30000000000000004,0,-1.5320667200554465,-0.01481389381748181
<,$ q $,", is not required . When no bias or a slight outwards bias is present , the stellar profile also evolves towards a near-exponential . This potentially allows this model",q,1,3,0,0,0,0,0,0.30000000000000004,0,-1.5320667200554465,-0.01481389381748181
and,$ T^\perp_p ( \ { \mathcal\ M ) $,"denote , respectively , the tangent and normal space of","T perpendicular to the power of p, in parentheses, M.",1,31,2,1,1,1,1,10.1,0,3.8903026696600356,0.009133901982147762
em whether simple conditions such as,$ \mu $,-irreducibility and aperiodicity can imply the existence of a WPI .,mu.,1,5,1,0,0,0,0,2.0,0,-0.8499488626858642,0.0005674600094270377
and the relation,"$ [ E_ { 13 } , E_ { 34 } ] =E_ { 14 } $",implies that,The commutator of E sub 13 and E sub 34 is equal to E sub 14.,1,38,0,1,3,0,6,9.3,1,5.446594768002528,0.12299883569574159
the MMSE estimate of,$ X $,is the conditional mean %,X,1,3,0,0,0,0,0,0.30000000000000004,0,-1.5320667200554465,-0.01481389381748181
for any,$ \varepsilon > 0 $,", that",Epsilon is greater than zero.,1,17,1,0,0,0,0,3.7,1,0.228030476226367,-0.2788758600412006
where,$ |m ( t ) \rangle $,and,"The absolute value of m of t, ketrangle.",1,18,1,0,0,0,0,3.3,0,-0.15577618063640475,0.0027246390296493915
,$ k $,and,k,1,3,0,0,0,0,0,0.30000000000000004,0,-1.5320667200554465,-0.01481389381748181
and each,$ z\in G $,",",z belongs to G.,1,8,1,0,0,0,0,2.3,0,-0.6897551668282966,0.001065270552555276
resulting in the selection of sector 5 at,$ I $,and sector 6 at,I,1,3,0,0,0,0,0,0.30000000000000004,0,-1.5320667200554465,-0.01481389381748181
,$ \vec k_1\to \vec k_1 + \vec k_g $,and,Vector k sub 1 goes to vector k sub 1 plus vector k sub g.,1,33,4,0,3,0,0,9.8,1,4.1126663102531165,-0.21886152375673035
99 &,$ > $,0.99 &,greater than,1,3,0,0,0,0,0,0.8,1,-1.0948621645734855,-0.2962484560406224
there are spectroscopic and imaging surveys at,$ z\sim3-4 $,"that statistically targeted the LyC radiation from galaxies . On the spectroscopy side , the Keck Lyman Continuum Spectroscopic Survey targeted LyC from 124 galaxies at",z is distributed approximately between 3 and 4.,1,10,1,0,0,0,0,3.0,1,-0.14575481410795735,-0.28003741797516646
where the infimum is taken over,"$ \varphi \in H^1 ( B^ { d } ( 0 , \widetilde { R } ) ) $",such that,"Phi belongs to H to the power of 1 of B to the power of d, open parenthesis, 0, comma, tilde R, close parenthesis.",1,55,3,1,0,2,4,14.0,0,6.90978191323637,-0.05557260294116656
,$ K_ { 6 } =K_ { L } K_ { 3 } $,is a cyclic sextic extension of~,K sub 6 equals K sub L times K sub 3.,1,29,0,1,3,0,6,8.4,1,4.966013680429826,0.12150540406635689
where the model parameters,$ \theta $,", which is represented as policy",Theta.,1,8,1,0,0,0,0,2.3,0,-0.6897551668282966,0.001065270552555276
a ball of radius,$ r $,"centered around zero , and a disagreement point at",r,1,3,0,0,0,0,0,0.30000000000000004,0,-1.5320667200554465,-0.01481389381748181
tending to,$ +\infty $,such that,Positive infinity.,1,9,1,0,0,0,0,2.9,1,-0.1991527127271466,-0.2802033548228759
which results in,$ \lambda_i=\lambda_j $,", or equivalently ,",lambda i equals lambda j.,1,21,2,0,2,0,0,6.1,1,1.9544528435529405,-0.254313103249478
intersecting the interior of,$ \gamma $,contains multiple infinite,Gamma.,1,8,1,0,0,0,0,2.3,0,-0.6897551668282966,0.001065270552555276
where,"$ m \equiv m ( Z , A ) $","is the electron-nucleus reduced mass ,",m is equivalent to m of Z and A.,1,22,1,0,0,0,0,3.7,0,0.05781541384035216,0.0033883864204870377
the forces and moments subjected to a particle,$ p \in V $,can be expressed as,p belongs to V.,1,9,1,0,0,0,0,2.4,0,-0.6363572682091074,0.001231207400264684
we denote by,$ R_0 $,the constant such that with probability at least,R sub zero.,1,5,0,0,1,0,0,1.5,0,-0.8545567731059536,-0.008993867909922706
peak of,$ P ( q ) $,at the Edwards Anderson order parameter,P of q,1,9,0,0,0,0,0,0.9,0,-1.2116793283403113,-0.013818272731225333
We denote by,$ \widehat { X } $,the set,X-hat.,1,16,1,1,0,0,2,5.1,0,1.4538961340652197,0.23186267243745526
,"$ \alpha \in ( 0,1 ) $",",",Alpha belongs to the open interval from 0 to 1.,1,20,2,0,0,0,0,5.0,0,0.5263416767331777,0.01810599285655824
and returns a,$ t $,-clustering,t,1,3,0,0,0,0,0,0.30000000000000004,0,-1.5320667200554465,-0.01481389381748181
