context_before,equation,context_after,spoken_English,latex_num_expressions,latex_total_length,latex_total_commands,latex_total_nesting_depth,latex_total_subscripts,latex_total_superscripts,latex_total_braces,latex_avg_complexity_score,latex_total_operators,pca_1,pca_2
derived major and minor axis are less by a factor of,$ f=\sqrt { A_ { \rm exact } /A_ { \rm ellipse } } $,", where",f equals the square root of A exact divided by A ellipse.,1,50,3,2,2,0,6,15.0,2,8.57041470291812,0.0268063666123383
and,$ g_ { a\gamma\gamma } = 10^ { -10 } { \rm GeV } ^ { -1 } $,. We will consider two different choices for the angles,g sub a gamma gamma equals ten to the power of negative ten GeV to the power of negative one.,1,57,3,1,1,2,8,15.2,3,9.938905859759174,-0.7286779005310257
with,$ \sigma_\ell ( \eta ) =\text { arg } \Gamma ( 1+\ell+i\eta ) $,", and",Sigma sub ell of eta equals arg Gamma open parenthesis 1 plus ell plus i eta close parenthesis.,1,61,7,1,1,0,2,18.1,3,8.783222575465722,-0.5134423733937338
with,"$ a= \alpha^ * { \hat a } +\beta\ , { \hat a } ^\dagger $",", is used and",a equals alpha times a hat plus beta times a hat dagger.,1,55,5,1,0,2,4,17.0,3,9.168120113241043,-0.8719041045024938
readers may wonder what if,"$ r_ { n , \textnormal { s } } ( p_n^ * , B_n^ * ) $",happens to be,"r sub n, s of p sub n star, B sub n star",1,50,1,2,3,2,4,16.5,2,9.173208011999762,-0.48718857731277376
parameters for sparse,$ \X_ { \char ` \\ k } ( \bgamma_ { \char ` \\ k } \be_ { \char ` \\ k } ) $,and non-sparse,"X subchar tilde k, open parenthesis, b gamma subchar tilde k, be sub char tilde k, close parenthesis.",1,74,6,1,3,0,6,18.4,0,9.975807750191368,0.49645045491558987
Here,"$ f_a = \sum_b v_ { ab } F_b , a_a = \sum_b v_ { ab } A_b $","are projections of the input and output vectors on each of the eigenmodes , and","f sub a equals the sum over b of v sub ab F sub b, a sub a equals the sum over b of v sub ab A sub b.",1,57,2,1,8,0,4,18.2,2,10.076694719447925,-0.1836225494155688
at which the giant temperature peak starts to grow by setting,$ T_ { m=0 } ^2 - \left ( \beta^2 - 1\right ) b^2 =0 $,", and get",T sub m equals 0 squared minus open parenthesis beta squared minus 1 close parenthesis b squared equals 0.,1,52,3,1,1,3,2,17.7,4,9.247542455524659,-1.463952250261018
such that,"$ 2^ { p_a } a\in \left ( \frac { n } { 4 } , \frac { n } { 2 } \right ] $",and let,"Two to the power of p sub a, a belongs to the interval from n divided by 4 to n divided by 2, inclusive.",1,72,5,1,1,1,10,17.2,0,10.40048292635664,0.4358455392133184
Each prompt,$ \vec { p } \in \bP_ { \langle \text { com } \rangle } $,or,Vector p belongs to the set of boldface mu and with angle brackets com.,1,55,6,2,1,0,6,19.5,0,9.322166702436258,0.6322922386343821
and these two spins are flipping simultaneously according to transition rate,$ W ( \sigma_ { i } \sigma_ { j } \to\sigma_ { i } '\sigma_ { j } ' ) $,given by,W sigma sub i sigma sub j to sigma sub i prime sigma sub j prime,1,69,5,1,4,0,8,15.9,0,10.12225071988724,0.567685236766252
,$ \mathcal { L } _ { \mathrm { RC } } ( \boldsymbol { x } _ { i } ) $,significantly differs from the prior focal loss~,L sub R C of x sub i,1,67,3,2,2,0,10,17.2,0,10.051609375015076,0.7621283309514543
as,$ B_\textrm { eq } ( r ) = l ( r ) ^\frac { -1 } { \alpha_ { nt } +3 } $,and hence is less sensitive to the exact choice of,B sub e q of r equals l of r raised to the power of negative one over alpha sub n t plus three.,1,70,3,2,2,1,8,20.0,3,11.701838603825424,-0.36930928527114054
then the quantum optimal value,$ \left ( \mathcal { B } _ { n } \right ) _ { Q } ^ { opt } $,will achieve for the observables in total dimension,"Left parenthesis, B sub n, right parenthesis, sub Q, superscript opt.",1,59,3,1,2,1,8,15.4,0,8.70833990054398,0.3274517581336974
,$ c_1 = \frac { a_2 \lVert \mathbf { h } _s \rVert_1^2 } { a_1 N } $,", and",c sub 1 equals the fraction with numerator a sub 2 norm of h sub s norm sub 1 squared and denominator a sub 1 N.,1,66,4,2,5,1,6,23.1,1,12.27934244773377,0.14065745938876922
em,$ \WFRS { \sigma_ { 11 } } { \sigma_ { 12 } } { \W \extends \W_1 } $,,WFS sigma sub 11 sigma sub 12 W pairs W sub 1,1,66,6,2,3,0,10,19.6,0,11.88705263309338,0.8083454364005839
between the empirical measures,$ \tfrac { 1 } { n } \sum_ { l=0 } ^ { n-1 } \delta_ { \vy^ { ( l ) } } $,and,"Fraction one over n, sum from l equals zero to n minus one, delta sub v y superscript l.",1,71,4,2,2,2,12,22.1,2,13.937655753347322,-0.10903333867476835
% where,"$ \mu=\min\ { \mu_ { x } /2 , \mu_ { \sigma } /2 \ } $",". % Equally , % %","mu equals the minimum of mu sub x divided by 2, mu sub sigma divided by 2.",1,52,5,2,2,0,6,17.2,3,10.06113958919725,-0.22632413680728902
we know that,$ \hat S = \mathcal { O } ( r^ { -2 } ) = \mathcal { O } ( \sigma^ { -4 } ) $,for large,Hat S equals big O of r to the power of negative 2 equals big O of sigma to the power of negative 4.,1,75,4,1,0,2,8,18.0,4,11.34188050080663,-0.9975642715760472
implies that,"$ \min\ { \deg_ { G'_t } ( u ) , \deg_ { G'_t } ( v ) \ } \ge \ell+1 $",and so the desired property,"Minimum of degree of G prime sub t of u, degree of G prime sub t of v, greater than or equal to ell plus one.",1,68,5,2,4,0,6,21.3,1,11.3864447422662,0.3523030567815089
This form is specified by the minimal sum of orders of all boundary conditions,$ \varkappa=\sum\limits_ { \nu=1 } ^ { 2\ell } k_ { \nu } $,.,varkappa equals the sum from nu equals 1 to 2ell of k sub nu.,1,57,6,1,2,1,6,19.2,2,10.376039848043995,-0.27648014393186265
We can identify,$ TP_ { \rm S } =h\nu_0 \sum_ { m=1 } ^N |A_m|^2 $,",",T sub S equals h nu sub zero sum from m equals 1 to N absolute value of A sub m squared.,1,48,3,1,4,2,4,18.3,2,9.693262332710425,-0.5976506764728524
Making the substitution,$ \theta=\arcsin\dfrac { z } { c\sqrt { 1-j^2 } } $,we see that,Theta equals arc sine of z divided by c times the square root of one minus j squared.,1,49,4,2,0,1,6,16.9,2,8.955211978133942,-0.1710387903061328
then,$ \mathbf { X } =\mathrm { Re } \circ \tilde { \mathbf { X } } : M \to \R^3 $,is a conformal and minimal immersion of,R,1,75,7,2,0,1,8,22.0,1,12.050359340356419,0.24148436436048154
bounds from SNO on,$ \epsilon^ { Au } _ { \alpha \beta } -\epsilon^ { Ad } _ { \alpha \beta } $,"can be found . In fact , Ref.~",Epsilon raised to the power of Au sub alpha beta minus epsilon raised to the power of Ad sub alpha beta.,1,74,6,1,2,2,8,18.4,1,11.861102182018962,-0.11660480737684555
is a diagonal matrix with diagonal vector,$ v \in \mathbb { R } ^ { \prod_ { k=1 } ^ { d } n_ { k } } $,given by,v belongs to the set of real numbers raised to the power of the product from k equals 1 to d of n sub k.,1,59,3,2,2,2,10,18.9,1,11.662394394388363,0.07160793208092474
and,$ P^ { 0 ( j ) } _ { \alpha\beta } \to P^ { 0 ( j ) } _ { \beta \alpha } $,", respectively . This indicates that if","P to the power of 0 j, sub alpha beta, goes to P to the power of 0 j, sub beta alpha.",1,72,5,1,2,2,8,17.7,0,10.945699355871035,0.15157517617427183
,$ P_a ( \Omega _ { t_1 } ) =\Omega _ { 2a-t_1 } =\Omega _ { t_2 } . $,,"P sub a, open parenthesis, Omega sub t1, close parenthesis, equals Omega sub 2a minus t1, equals Omega sub t2.",1,67,3,1,7,0,6,18.7,3,11.470526544753772,-0.3722106212337065
by,$ \partial_ { A_ { ik } } \mathcal { E } =\alpha_ { ik } $,and impose the compatibility condition with the energy conservation equation yielding,Partial derivative with respect to A sub i k of E equals alpha sub i k.,1,56,3,2,3,0,8,17.6,1,9.850191235481548,0.40060404645220576
we choose,"$ ( \varphi_ { 10 } , \varphi_ { 20 } ) = ( - \Phi_ { 01 } , - \Phi_ { 02 } ) $",to keep,"Phi sub 10, Phi sub 20 equals negative Phi sub 01, negative Phi sub 02.",1,77,4,1,4,0,8,18.2,3,11.489645101859049,-0.2882136600980987
with,$ r_ { \corigin } ^ { t ' } < \tilde \xi_ { \corigin } ^ { t ' } $,. Together with,r sub c origin to the power of t prime is less than tilde xi sub c origin to the power of t prime.,1,64,4,1,2,2,8,17.4,1,10.584318248971895,-0.14410958580714842
By the definition of spectral norm and bound,$ \bm { \Sigma } _ { k+1|k } \preceq\bar { \sigma } \mathbf { I } $,from one of the assumptions of Theorem~,"Sigma sub k plus one given k is a preset of sigma bar, I bold.",1,65,6,1,1,0,8,19.0,1,9.820802052001152,0.2905522761119998
we set,$ \gamma= ( \lceil\frac { n } { 2 } \rceil+1 ) \cdot ( n+1 ) +n $,and remark that,"Gamma equals the ceiling of n divided by 2 plus 1, multiplied by n plus 1, plus n.",1,63,5,1,0,0,4,17.8,4,8.635663791535293,-0.74212605492336
which takes the current state embedding but only the current action token as input :,"$ \hat { c } _ { t+1 } =C_f ( s_ { t } ^+ , a ' _ { t } ) $",. As shown in~,c hat sub t plus one equals C sub f open parenthesis s sub t superscript plus comma a prime sub t close parenthesis,1,57,1,1,4,1,8,15.7,3,9.903941948911305,-0.5363064580698425
does not come from a global spectrum as the restriction map,$ \res^ { G } _e \colon \pi_0^ { G } ( R ) \to \pi_0 ( R ) $,"is not surjective , compare with",R,1,58,5,1,3,2,4,18.8,0,9.728842591786071,-0.01063815065352305
,$ \rho_n^A=\Tr_ { \bar { A } } \rho_n $,denotes the reduced density matrix of a subsystem,Rho sub n equals Trace sub A-bar Rho sub n.,1,37,4,2,3,1,4,16.7,1,8.763495541735915,0.03898964206258559
The concatenated message,"$ { { \rm m } _ { \frak { n } ( t ) , [ \kappa ( t ) ] } } $",is encoded as a codeword,m sub k n of t comma kappa of t,1,58,3,3,1,0,8,17.3,0,9.472862329840217,0.817111515886265
the multiplicative term,$ ( \hat { \sigma } _3-\langle\hat { \sigma } _3\rangle ) dW_t $,instead introduces a stochastic increment that is taken from a Gaussian distribution with a state-dependent standard deviation . The stochastic increments in its time evolution thus depend on the instantaneous,"Open parenthesis, hat sigma sub 3 minus angle bracket, hat sigma sub 3, angle bracket, close parenthesis, d W sub t.",1,62,6,1,3,0,4,17.7,1,9.150277562327537,0.12927208135649187
one can see that,$ \gamma_x = \frac { N-2n } { 2 } \sin ( \theta ) \cos ( \varphi ) $,and,Gamma sub x equals open fraction N minus 2n close fraction divided by 2 sine theta cosine phi.,1,66,6,1,1,0,4,19.6,2,9.067484586271258,-0.15822148759032037
and a step at,$ E= \sqrt { \lambda^ { 2 } + 4 \lambda_ { R } ^ { 2 } } $,", respectively , as shown by the black dot-dashed curve of Fig .",E equals the square root of lambda squared plus 4 lambda R squared.,1,56,3,2,1,2,8,16.6,2,10.542811557682503,-0.30169193721581444
87,$ $ \pm $ \scriptsize $ 0.84 $ & $ 87.56 $ $,,plus or minus zero point eight four and 87 point 56.,4,18,1,0,0,0,0,0.825,0,-1.6503659801877304,101.63760141052225
We will find a circuit,$ X\in \mathcal { C } $,such that,X belongs to the set C.,1,21,2,1,0,0,2,7.1,0,2.2962076872923696,0.24774183680749234
In dimension,$ d=2 $,", we take for instance",d equals two.,1,5,0,0,0,0,0,1.0,1,-0.9880663673351072,-0.2959165823452035
forces,$ E $,to stay in,E,1,3,0,0,0,0,0,0.30000000000000004,0,-1.5320667200554465,-0.01481389381748181
the utility function of generation,$ t $,is,t,1,3,0,0,0,0,0,0.30000000000000004,0,-1.5320667200554465,-0.01481389381748181
,$ d $,", and",d,1,3,0,0,0,0,0,0.30000000000000004,0,-1.5320667200554465,-0.01481389381748181
has a unique,$ G $,-fixed point in,G,1,3,0,0,0,0,0,0.30000000000000004,0,-1.5320667200554465,-0.01481389381748181
is the effective pion-nucleon coupling constant given as,$ g_ { \pi NN } ^2/ ( 4\pi ) \simeq 14.9 $,~,g sub pi N N squared divided by open parenthesis 4 pi close parenthesis is approximately equal to 14.9,1,40,3,1,1,1,2,11.5,1,5.490470766100048,-0.21600823905328148
it is worth noting that the parameters,$ \Tilde { Q } $,and,Q with a tilde.,1,14,1,1,0,0,2,4.9,0,1.3471003368268413,0.23153079874203641
/10,$ & $,-20,and,1,3,0,0,0,0,0,0.30000000000000004,0,-1.5320667200554465,-0.01481389381748181
% for sufficiently small,$ \epsilon > 0 $,", we have that",Epsilon is greater than zero.,1,14,1,0,0,0,0,3.4000000000000004,1,0.06783678036879943,-0.2793736705843288
and,$ \psi $,above we find that,Psi.,1,6,1,0,0,0,0,2.1,0,-0.796550964066675,0.0007333968571364458
,$ \psi_n $,converges to some,Psi sub n.,1,8,1,0,1,0,0,3.3,0,-0.11904101711718226,0.006553422764695557
We define a rescaling,$ t_w $,as,t sub w.,1,5,0,0,1,0,0,1.5,0,-0.8545567731059536,-0.008993867909922706
-module of the,$ D_ { 2n } $,-invariants,D sub 2n.,1,11,0,1,1,0,2,4.1,0,1.1822987305491843,0.22147166027955847
that in the limit of small,$ \gamma $,", the zero frequency gap has the form",Gamma.,1,8,1,0,0,0,0,2.3,0,-0.6897551668282966,0.001065270552555276
and let,$ v_0 \defeq \0_m $,. Lemma~,v sub zero is defined as zero sub m.,1,17,1,0,2,0,0,5.2,0,0.9322542201666351,0.013535006606220552
,$ \Delta\lambda $,= 0.02,Delta lambda.,1,15,2,0,0,0,0,4.5,0,0.2593521836372316,0.017276308618011178
are some positive constants only depend on,$ p $,and,p,1,3,0,0,0,0,0,0.30000000000000004,0,-1.5320667200554465,-0.01481389381748181
where,"$ ( u , x ) $",and,u comma x.,1,11,0,0,0,0,0,1.1,0,-1.104883531101933,-0.013486399035806503
,$ is negative at small $,q,not at small.,1,22,0,0,0,0,0,2.2,0,-0.5175066462908516,-0.011661093711002987
to any intermediate edge,$ e $,of,e,1,3,0,0,0,0,0,0.30000000000000004,0,-1.5320667200554465,-0.01481389381748181
should not use bound variables of,$ \varphi $,", while in the rules",phi.,1,9,1,0,0,0,0,2.4,0,-0.6363572682091074,0.001231207400264684
the authors have discovered that the,$ \mZ_2 $,invariant combined with irreps at 0-cells can detect fractional corner charges in various tetrahedral and cubic space groups .,Z sub 2.,1,7,1,0,1,0,0,3.2,0,-0.17243891573637143,0.0063874859169861485
for all,$ \mathrm { F } \in \calF ( M ) $,. Let,F belongs to the set of F of M.,1,31,3,1,0,0,2,9.6,0,3.405508733615465,0.2644506854160765
where the number of nodes is,$ 64 $,", the number of edges is",64,1,4,0,0,0,0,0,0.4,0,-1.4786688214362573,-0.014647956969772401
and,"$ N ' _ { n , \delta } $",are such that,N prime sub n comma delta,1,22,1,1,1,0,2,6.7,0,2.3449976754914696,0.23834644573585204
from diverging from a prior distribution,$ \nu_0 $,by quantifying the allowed dissimilarity between the two distributions,nu sub zero.,1,7,1,0,1,0,0,3.2,0,-0.17243891573637143,0.0063874859169861485
with the weighted,$ \ell_p $,metric and,ell sub p.,1,8,1,0,1,0,0,3.3,0,-0.11904101711718226,0.006553422764695557
reduced mass,$ \mu=\tfrac { m_1m_2 } { M } $,", and symmetric mass ratio",mu equals the product of m sub 1 and m sub 2 divided by M.,1,29,2,1,2,0,4,10.4,1,4.923983691065596,0.06236364295375218
,$ O ( { T } { N_1 } ) $,and,Big O of T times N sub 1,1,21,0,1,1,0,4,5.1,0,2.338237676656599,0.3068835979200971
be the maximum value of,$ n_i $,and correspondingly,n sub i.,1,5,0,0,1,0,0,1.5,0,-0.8545567731059536,-0.008993867909922706
/,$ E_0 $,becomes nearly independent of the fractional ionization for,E zero.,1,5,0,0,1,0,0,1.5,0,-0.8545567731059536,-0.008993867909922706
is a Poisson process with intensity,$ 1/\varepsilon $,". In this paper , we choose a sub-",One divided by epsilon.,1,15,1,0,0,0,0,3.5,1,0.12123467898798858,-0.2792077337366194
& 1 & 2 & 3 & 4 & 5 &,$ > 5 $,,Greater than five.,1,5,0,0,0,0,0,1.0,1,-0.9880663673351072,-0.2959165823452035
the cosine of angle,$ \cos\theta $,should be uniformly sampled as,cosine theta.,1,12,2,0,0,0,0,4.2,0,0.0991584877796639,0.016778498074882946
as a function of,$ m_1 $,while Eq .,m sub 1,1,5,0,0,1,0,0,1.5,0,-0.8545567731059536,-0.008993867909922706
,$ b $,",",b,1,3,0,0,0,0,0,0.30000000000000004,0,-1.5320667200554465,-0.01481389381748181
with associated singular value,$ s $,:,s,1,3,0,0,0,0,0,0.30000000000000004,0,-1.5320667200554465,-0.01481389381748181
,$ T_\text { B } \gtrsim 100 \hbar /v $,", the readout dot occupation is still close to the clean result",T sub B is greater than or equal to 100 h-bar divided by v.,1,36,3,1,1,0,2,11.6,1,4.680416931904486,-0.010666040356376727
,$ T_n $,", and",T sub n.,1,5,0,0,1,0,0,1.5,0,-0.8545567731059536,-0.008993867909922706
&,$ - $,,minus,1,3,0,0,0,0,0,0.8,1,-1.0948621645734855,-0.2962484560406224
such that magnetic diffraction peaks are seen to project onto the,$ M $,-points ( blue ) and the ``,M,1,3,0,0,0,0,0,0.30000000000000004,0,-1.5320667200554465,-0.01481389381748181
At,$ t=0 $,", the agents know there are three possible",t equals zero.,1,5,0,0,0,0,0,1.0,1,-0.9880663673351072,-0.2959165823452035
besides the significantly large buffers required to store the,$ M $,"inputs and the output hypervector , takes",M,1,3,0,0,0,0,0,0.30000000000000004,0,-1.5320667200554465,-0.01481389381748181
in the second and the third assertions of the theorem can not be replaced by any constant smaller than,$ 1-1/e $,. Our methods can also be used to prove a variant of Theorem~,One minus one divided by e.,1,7,0,0,0,0,0,1.7000000000000002,2,-0.44406601461476813,-0.5770192708729253
&,$ y $,&,y,1,3,0,0,0,0,0,0.30000000000000004,0,-1.5320667200554465,-0.01481389381748181
the equations presented do not depend on the characteristic velocity,$ U_b $,. The choice of,U sub b.,1,5,0,0,1,0,0,1.5,0,-0.8545567731059536,-0.008993867909922706
,$ R^2 $,of regressing,R squared.,1,5,0,0,0,1,0,1.5,0,-0.6248890963946476,-0.2183611910549197
uses the following bound on the moment generating function of,$ S_n $,in,S sub n.,1,5,0,0,1,0,0,1.5,0,-0.8545567731059536,-0.008993867909922706
the function,$ R_V|_K $,is integrable %,R sub V given K,1,8,0,0,2,0,0,2.8,0,-0.12364892753727165,-0.003007905154654173
we can allow the,$ \tau_ * $,in Theorem,Tau star.,1,9,1,0,1,0,0,3.9,1,0.3715614369839678,-0.27471520261073556
assume~,$ B $,has bidegree~,B,1,3,0,0,0,0,0,0.30000000000000004,0,-1.5320667200554465,-0.01481389381748181
is surjective for every,$ x\in A $,and for every,x belongs to A.,1,8,1,0,0,0,0,2.3,0,-0.6897551668282966,0.001065270552555276
60\ % nodes in Rand and,$ > $,80,greater than,1,3,0,0,0,0,0,0.8,1,-1.0948621645734855,-0.2962484560406224
We must show that,$ p\mid b $,,p divides b,1,9,1,0,0,0,0,2.4,0,-0.6363572682091074,0.001231207400264684
while the average prediction performance of DySuseC is,$ 24.5\ % $,better than DySuseP in IC model .,twenty-four percent,1,9,0,0,0,0,0,0.9,0,-1.2116793283403113,-0.013818272731225333
is sensitive to the value of,$ \tau $,", as on changing",Tau.,1,6,1,0,0,0,0,2.1,0,-0.796550964066675,0.0007333968571364458
and,$ \gamma^ { tip } $,"represent the translation along the centerline and the distance from the centerline to the tip , respectively . Then our manipulation system can be treated as a forward/inverse transition function~",gamma to the power of tip.,1,17,1,1,0,1,2,6.2,0,2.3076758591068294,0.028149438352307928
showing that the index AFPI always performs better than,$ \langle P \rangle $,". In other words , the eigenportfolio based on the largest eigenvalue outperforms the equally weighted portfolio under the buy-and-hold strategy . Of particular interest is the steeper rise of",angle bracket P angle bracket.,1,19,2,0,0,0,0,4.9,0,0.4729437781139884,0.017940056008848824
assume that,$ M $,is connected . Note that when,M,1,3,0,0,0,0,0,0.30000000000000004,0,-1.5320667200554465,-0.01481389381748181
is contained in a MWVC \\ \hline % independent set,$ S $,is inclusive & independent set,S,1,3,0,0,0,0,0,0.30000000000000004,0,-1.5320667200554465,-0.01481389381748181
stripes and outside the,$ P\approx 5 $,"contours , while deformed nuclei exhibiting no SC are falling within the",P approximately 5,1,12,1,0,0,0,0,2.7,0,-0.47616357235153983,0.0017290179433929222
,$ = $,,equals,1,3,0,0,0,0,0,0.8,1,-1.0948621645734855,-0.2962484560406224
to compute the SimRank between,$ s $,and,s,1,3,0,0,0,0,0,0.30000000000000004,0,-1.5320667200554465,-0.01481389381748181
changing the order of two adjacent Reeb chords in the pinching sequence corresponds exactly to a Lagrangian mutation along the corresponding,$ \sf I $,"-cycle . % For more general mutations of Legendrian weaves , however , it may be nontrivial to detect when it comes from Hamiltonian isotopies plus some square moves of",capital I.,1,7,1,0,0,0,0,2.2,0,-0.7431530654474858,0.0008993337048458608
while the coefficient of,$ \hat { g } $,in the varied action gives the equation of motion . Notice that since,g-hat.,1,12,1,1,0,0,2,4.7,0,1.2403045395884629,0.23119892504661763
there are subwords,$ s_1s_2c_2 $,",",s sub 1 s sub 2 c sub 2,1,11,0,0,3,0,0,4.1,0,0.6072589180314105,0.0029780576006143596
and,$ q $,"are the Boltzmann constant and the carrier charge , respectively . The enhancement of low-temperature",q,1,3,0,0,0,0,0,0.30000000000000004,0,-1.5320667200554465,-0.01481389381748181
converges as,$ n \to \infty $,.,n tends to infinity.,1,14,2,0,0,0,0,4.4,0,0.20595428501804242,0.01711037177030177
em Any randomized algorithm that determines whether,$ M $,is connected with bounded error 1/3 needs at least,M,1,3,0,0,0,0,0,0.30000000000000004,0,-1.5320667200554465,-0.01481389381748181
is that with real,$ y $,,y,1,3,0,0,0,0,0,0.30000000000000004,0,-1.5320667200554465,-0.01481389381748181
,$ \rho $,"is the gas density ,",rho.,1,6,1,0,0,0,0,2.1,0,-0.796550964066675,0.0007333968571364458
and the second voter approves,$ c_1 $,and,c sub one.,1,5,0,0,1,0,0,1.5,0,-0.8545567731059536,-0.008993867909922706
-- action on,$ C_U $,"is without fixed points , and hence the map",C sub U.,1,5,0,0,1,0,0,1.5,0,-0.8545567731059536,-0.008993867909922706
t,$ . $,U,dot,1,3,0,0,0,0,0,0.30000000000000004,0,-1.5320667200554465,-0.01481389381748181
\ee and if,$ E $,has bad reduction at,E,1,3,0,0,0,0,0,0.30000000000000004,0,-1.5320667200554465,-0.01481389381748181
which means,$ u_h^0 + e_H^0 = u_H $,. By observing the the Step 2 of Algorithm,u sub h superscript 0 plus e sub H superscript 0 equals u sub H.,1,21,0,0,3,2,0,8.1,2,3.6164106680320653,-0.9659900402342861
in,$ \mathcal { B ( H ) } . $,The numerical range of,math call B of H,1,24,1,1,0,0,2,5.9,0,1.8810793230187337,0.23319016721913055
&,$ 11 $,&,Eleven.,1,4,0,0,0,0,0,0.4,0,-1.4786688214362573,-0.014647956969772401
where,"$ ( x_ { h } , y_n ( h ) ) $","are the center of the Riemann problem , and","Open parenthesis, x sub h, comma, y sub n of h, close parenthesis.",1,26,0,1,2,0,2,6.6,0,2.553981359548137,0.22944886520733992
&,$ 0.9893 $,&,zero point nine nine three.,1,8,0,0,0,0,0,0.8,0,-1.2650772269595005,-0.013984209578934755
Grouping elements in,$ F $,with non-trivial stabilizer subgroups into orbits ( see Appendix,F,1,3,0,0,0,0,0,0.30000000000000004,0,-1.5320667200554465,-0.01481389381748181
We obtain a finite partition,$ \ { A_i\ } $,of,A sub i.,1,12,0,1,1,0,2,4.2,0,1.2356966291683735,0.22163759712726788
&,$ \sim 10^ { -7 } $,--,Approximately ten to the power of negative seven.,1,17,1,1,0,1,2,6.7,1,2.74488041458879,-0.25328512387083263
the temporal task network of,$ m $,. %,m,1,3,0,0,0,0,0,0.30000000000000004,0,-1.5320667200554465,-0.01481389381748181
Since,$ \frac { ( 2-x ) } { \kappa ( x ) } < C_2 $,for,"Fraction, open parenthesis, two minus x, close parenthesis, divided by, kappa of x, less than, C sub 2.",1,42,2,1,1,0,4,11.2,2,5.484646778885902,-0.22240189246130634
satisfies for any bin,$ i \in [ n ] $,,i belongs to the set of integers from 1 to n.,1,13,1,0,0,0,0,2.8,0,-0.4227656737323507,0.0018949547911023372
The irrep subscript,$ g $,means even under parity . The irrep superscripts,g,1,3,0,0,0,0,0,0.30000000000000004,0,-1.5320667200554465,-0.01481389381748181
holds with,$ \gamma=0 $,", estimand",Gamma equals zero.,1,10,1,0,0,0,0,3.0,1,-0.14575481410795735,-0.28003741797516646
em \noindent For resonators with relatively slender cavities of length,$ L $,", a relatively small value of",L,1,3,0,0,0,0,0,0.30000000000000004,0,-1.5320667200554465,-0.01481389381748181
-divergence with,$ f\left ( t\right ) =t\log\left ( t^ { k } \right ) $,". % In comparison , KL-divergence is a special case of",f of t equals t log of t to the power of k.,1,52,5,1,0,1,2,13.2,1,6.507255933377995,-0.19153296398481442
For,"$ i \in \ { 0,1 , \ldots , i^ * \ } $",", let","i belongs to the set of 0, 1, dot dot dot, i star.",1,35,2,1,0,1,2,10.0,1,4.2813646498654,-0.2352487804805732
To account for the blowup of,$ p ( x ) $,to,p of x,1,9,0,0,0,0,0,0.9,0,-1.2116793283403113,-0.013818272731225333
to reach assignment,$ C_ { j_ { i+1 } } $,where it has a neighbor of the same type and a neighbor of different type . Note that,C sub j sub i plus 1,1,19,0,2,2,0,4,8.4,1,4.333868736635776,0.17632265215345816
poses more flexible relations on,$ t $,",",t,1,3,0,0,0,0,0,0.30000000000000004,0,-1.5320667200554465,-0.01481389381748181
The Cooper-Frye particlization of fluid cells is performed on a hyper-surface with a constant energy density of,$ e_ { \rm sw } = $,0.50 GeV/fm,e sub s w equals,1,17,1,1,1,0,2,6.7,1,2.5152127378774845,-0.04391780072583563
contains a copy of,$ F $,. Inheriting from the structure of,F,1,3,0,0,0,0,0,0.30000000000000004,0,-1.5320667200554465,-0.01481389381748181
greater than or equal to,$ g_ { \mathsf { init } } $,such that,g sub init,1,25,1,2,1,0,4,9.0,0,4.22165948328904,0.46831416338220494
in agreement with the trivial,$ z_2 $,"invariant . During the phase transition to the Dirac semimetal , the helical edge states merge into the projections of the bulk Dirac points , connecting the neighboring projected Dirac",z sub 2,1,5,0,0,1,0,0,1.5,0,-0.8545567731059536,-0.008993867909922706
,$ \tau $,-midpoints imply being causally geodesic ],Tau.,1,6,1,0,0,0,0,2.1,0,-0.796550964066675,0.0007333968571364458
Optimizing over,$ \delta $,yields :,delta.,1,8,1,0,0,0,0,2.3,0,-0.6897551668282966,0.001065270552555276
Assuming that for each,$ n\in\N $,and,n belongs to the set of natural numbers.,1,8,2,0,0,0,0,3.8,0,-0.11443310669709292,0.0161147506840453
Then for all,$ n \geq 1 $,", with probability at least",n is greater than or equal to 1.,1,10,1,0,0,0,0,2.5,0,-0.5829593695899182,0.0013971442479740921
We perform the electronic band structure and DOS calculations for B,$ _2Rh_2 $,Zn and B,sub 2 R h sub 2,1,8,0,0,2,0,0,2.8,0,-0.12364892753727165,-0.003007905154654173
