context_before,equation,context_after,spoken_English,latex_num_expressions,latex_total_length,latex_total_commands,latex_total_nesting_depth,latex_total_subscripts,latex_total_superscripts,latex_total_braces,latex_avg_complexity_score,latex_total_operators,pca_1,pca_2
to the point,$ c $,". This squared distance becomes smaller , when",c,1,3,0,0,0,0,0,0.30000000000000004,0,-1.5320667200554465,-0.01481389381748181
The principal chooses an inspection policy,$ \mathbf { T } $,to minimize the expected discounted inspection cost,T,1,15,1,1,0,0,2,5.0,0,1.4004982354460305,0.23169673558974585
while,$ c_m $,is an,c sub m,1,5,0,0,1,0,0,1.5,0,-0.8545567731059536,-0.008993867909922706
&,$ 0.610^ { +0.070 } _ { -0.066 } $,&,"0.610 raised to the power of positive 0.070, subscript negative 0.066.",1,32,0,1,1,1,4,8.2,2,4.600405498854022,-0.4580393921342373
defined over a field,$ K $,is,K,1,3,0,0,0,0,0,0.30000000000000004,0,-1.5320667200554465,-0.01481389381748181
including the iteration,$ \xi $,", the global optimization frequency",xi.,1,5,1,0,0,0,0,2.0,0,-0.8499488626858642,0.0005674600094270377
in the case of index-,$ 3 $,subgroups,three,1,3,0,0,0,0,0,0.30000000000000004,0,-1.5320667200554465,-0.01481389381748181
,$ f\geq0 $,is critical or supercritical in the sense that,f greater than or equal to zero,1,8,1,0,0,0,0,2.3,0,-0.6897551668282966,0.001065270552555276
Suppose the results of an experiment induce a partition,$ \mathcal { E } =\ { E_j\ } $,of the state space of interest,E equals E sub j.,1,28,1,1,1,0,4,7.800000000000001,1,3.7245495826040886,0.041660073762412424
and,$ k ( x ) $,"an integer , the dataset is said to satisfy",k of x,1,9,0,0,0,0,0,0.9,0,-1.2116793283403113,-0.013818272731225333
is given by,$ M_ { 200 } $,", which we abbreviate with",M sub 200.,1,12,0,1,1,0,2,4.2,0,1.2356966291683735,0.22163759712726788
,$ & $,1.50,and,1,3,0,0,0,0,0,0.30000000000000004,0,-1.5320667200554465,-0.01481389381748181
,$ Z $,",",Z,1,3,0,0,0,0,0,0.30000000000000004,0,-1.5320667200554465,-0.01481389381748181
where,$ \mathcal { P } $,is the number of fragments and,P in calligraphic font.,1,16,1,1,0,0,2,5.1,0,1.4538961340652197,0.23186267243745526
Although the matrix spectral,$ p $,"-norm is NP-hard to compute as aforementioned , fortunately , ~",p,1,3,0,0,0,0,0,0.30000000000000004,0,-1.5320667200554465,-0.01481389381748181
assume that,$ \eta_ { k+1 } $,is chosen to ensure that,Eta sub k plus 1.,1,15,1,1,1,0,2,6.5,1,2.408416940639106,-0.04424967442125447
GY and,$ p $,r,p,1,3,0,0,0,0,0,0.30000000000000004,0,-1.5320667200554465,-0.01481389381748181
This means that we have a case of bistability : in the range,$ K_i^ { ( \mathrm { sync } ) } < K < K_i $,", depending on the initial condition , the system can settle asymptotically into either an incoherent or a synchronized state . On the other hand , by adiabatically tuning the",K sub i superscript open parenthesis c close parenthesis is less than K is less than K sub i.,1,41,1,2,2,1,4,13.600000000000001,2,7.321530948293525,-0.29029099022144206
and hence,$ Y_n $,"is large enough , every event that",Y sub n.,1,5,0,0,1,0,0,1.5,0,-0.8545567731059536,-0.008993867909922706
each profile,$ P_i $,is Lipschitz . It is equivalent to~,P sub i.,1,5,0,0,1,0,0,1.5,0,-0.8545567731059536,-0.008993867909922706
has a section for any,$ Y : \List ( RA ) \rightarrow \mathcal\ { U $,. By Lemma,"Y: List of R Ad, maps to U",1,44,3,1,0,0,1,10.9,0,3.7887014357071633,0.2247315798545766
X,"$ , viewed as a ringed space . This fact is based on interpreting $",X,"u, v, a, r, e, d, space, Theta, is, based on interpreting.",1,65,0,0,0,0,0,6.5,0,1.7786029943342845,-0.004525809259498272
for some,$ n\geq0 $,depending on,n greater than or equal to zero,1,8,1,0,0,0,0,2.3,0,-0.6897551668282966,0.001065270552555276
to,$ A $,". If we wanted to define a model for many-sorted binding logic , then we would need many-sorted intensional functional structures that would exactly be multicategories with projections .",A,1,3,0,0,0,0,0,0.30000000000000004,0,-1.5320667200554465,-0.01481389381748181
and,$ \mathbf { Y } $,points . % One notices that,Y,1,15,1,1,0,0,2,5.0,0,1.4004982354460305,0.23169673558974585
The bijection maps,$ \pi_n $,"to itself always , by Lemma",pi sub n.,1,7,1,0,1,0,0,3.2,0,-0.17243891573637143,0.0063874859169861485
,$ \tau $,of the black hole ringdown does not depend on,Tau.,1,6,1,0,0,0,0,2.1,0,-0.796550964066675,0.0007333968571364458
at,"$ \Feature = ( \Z^ * _k , u_k ) $",the posterior prediction of,Feature equals open parenthesis Z star sub k comma u sub k close parenthesis.,1,31,2,0,2,1,0,10.1,2,3.9299377983528303,-0.7358406927734955
and,$ j\in [ k ] $,", we say that two vertices",j belongs to the set of integers from 1 to k.,1,12,1,0,0,0,0,2.7,0,-0.47616357235153983,0.0017290179433929222
points,$ z_j\in\partial\Delta_j $,coming from the endpoints of,z sub j belongs to the boundary of delta sub j.,1,24,3,0,2,0,0,8.9,0,2.4566836307633673,0.04479552480316649
the empty node~,$ v $,is not adjacent to~,v,1,3,0,0,0,0,0,0.30000000000000004,0,-1.5320667200554465,-0.01481389381748181
40,$ \pm $,0.06 & & 9,Plus or minus.,1,5,1,0,0,0,0,2.0,0,-0.8499488626858642,0.0005674600094270377
and stars near apocenter with smaller,$ R_g $,". Therefore , the subsample includes different features due to having stars at different guiding radii . We see this effect in the sixth row of Figure~",R sub g.,1,5,0,0,1,0,0,1.5,0,-0.8545567731059536,-0.008993867909922706
- and,$ P $,-wave amplitudes . In addition to the relations already given in,P,1,3,0,0,0,0,0,0.30000000000000004,0,-1.5320667200554465,-0.01481389381748181
Both transcription rate,$ R $,( left ) and,R,1,3,0,0,0,0,0,0.30000000000000004,0,-1.5320667200554465,-0.01481389381748181
and the latter has,$ 2 $,-measure zero . By Theorem,two,1,3,0,0,0,0,0,0.30000000000000004,0,-1.5320667200554465,-0.01481389381748181
function such that,$ \sum_A \pi_\phi ( a_t|s_t ) = 1 $,. The parameters of the actor are learned by minimizing the approximated form of the expected KL-divergence with the temperature parameter,"The sum over A of pi sub phi, evaluated at a sub t given s sub t, equals one.",1,33,3,0,4,0,0,12.3,1,4.51589757324026,-0.2241693013663088
Eve mixes her two ancillary modes,$ E_1 $,and,E sub 1.,1,5,0,0,1,0,0,1.5,0,-0.8545567731059536,-0.008993867909922706
where the blackout resonances in the 410-580,$ \mu s $,"ToF window are identified . In order to improve the power of the statistical comparisons through sample size , all obviously blacked-out resonances from the RRR were considered . The",mu s,1,7,1,0,0,0,0,2.2,0,-0.7431530654474858,0.0008993337048458608
we first get a copy of,$ \Phi ( X ) $,". Further , the",Phi of X.,1,12,1,0,0,0,0,2.7,0,-0.47616357235153983,0.0017290179433929222
and,$ \tau ( k ) $,is defined as in,Tau of k.,1,12,1,0,0,0,0,2.7,0,-0.47616357235153983,0.0017290179433929222
Let,"$ \mu_0 , \mu_1 \in \mathcal { P } ( M ) $",have finite second order moments . Suppose :,"mu sub 0, mu sub 1, belongs to the set of P of M",1,40,4,1,2,0,2,12.5,0,5.3989205940379845,0.2898431264463462
In order to give a precise characterization of the relation between the range,$ \Delta\phi $,and the gap,Delta phi.,1,12,2,0,0,0,0,4.2,0,0.0991584877796639,0.016778498074882946
em suppose,$ \deg D=2 $,", then",degree D equals two.,1,10,1,0,0,0,0,3.0,1,-0.14575481410795735,-0.28003741797516646
and,$ v $,is the velocity of the rear wheel with respect to,v,1,3,0,0,0,0,0,0.30000000000000004,0,-1.5320667200554465,-0.01481389381748181
For every Rademacher sum,$ X $,", we have",X,1,3,0,0,0,0,0,0.30000000000000004,0,-1.5320667200554465,-0.01481389381748181
,$ p_ { ijk } $,and,p sub i j k.,1,12,0,1,1,0,2,4.2,0,1.2356966291683735,0.22163759712726788
Alice can get the,$ |0\rangle $,with probability,ket zero.,1,11,1,0,0,0,0,2.6,0,-0.529561470970729,0.0015630810956835071
9,$ \pm $,335.2,Plus or minus.,1,5,1,0,0,0,0,2.0,0,-0.8499488626858642,0.0005674600094270377
,$ ^\textrm { \scriptsize 24 } $,",",24,1,29,2,1,0,1,2,8.9,0,3.5237727026683037,0.045190160656310895
and eccentricity,$ e $,. We consider sources with,e,1,3,0,0,0,0,0,0.30000000000000004,0,-1.5320667200554465,-0.01481389381748181
and total volumetric flow rate,$ Q $,,Q,1,3,0,0,0,0,0,0.30000000000000004,0,-1.5320667200554465,-0.01481389381748181
is an irrational number,$ \alpha $,with the property that for each positive integer~,Alpha.,1,8,1,0,0,0,0,2.3,0,-0.6897551668282966,0.001065270552555276
The five real quantum spectra of the,$ x^ { 10 } $,"potential , one Hermitian spectrum and two identical up-down symmetric pairs of spectra , correspond to the five left-right-symmetric pairs of turning points in Fig.~",x raised to the power of 10,1,11,0,1,0,1,2,4.1,0,1.4119664072604905,0.012104337134561435
denotes the number of codewords in,$ C $,of weight,C,1,3,0,0,0,0,0,0.30000000000000004,0,-1.5320667200554465,-0.01481389381748181
let,"$ f\in \msD^ { \gamma , \eta } _P ( V ) $",for some,"f belongs to the space D superscript gamma, eta, subscript P, open parenthesis V, close parenthesis.",1,39,4,1,1,1,2,13.9,0,5.779109958833717,0.08243664160852535
If,$ \eta\neq 0 $,and,Eta is not equal to zero.,1,12,2,0,0,0,0,4.2,0,0.0991584877796639,0.016778498074882946
where the OP was found in a single-integral form for a single-antenna,$ N $,-port FAS over spatially Nakagami-,N,1,3,0,0,0,0,0,0.30000000000000004,0,-1.5320667200554465,-0.01481389381748181
and,"$ t , h > 0 $",we have,"t, h greater than zero.",1,11,0,0,0,0,0,1.6,1,-0.6676789756199721,-0.29492096125894707
& BB,$ _H $,& StPop & T,H: None,1,4,0,0,1,0,0,1.4,0,-0.9079546717251429,-0.009159804757632114
and,$ b_2 $,have the same reachability since they are joined by an edge with lowest label,b sub 2,1,5,0,0,1,0,0,1.5,0,-0.8545567731059536,-0.008993867909922706
until we reach a node,$ T_j $,neither of whose child nodes contains more than,T subscript j.,1,5,0,0,1,0,0,1.5,0,-0.8545567731059536,-0.008993867909922706
contains the numbers,$ 0 $,and,zero,1,3,0,0,0,0,0,0.30000000000000004,0,-1.5320667200554465,-0.01481389381748181
where we replaced,$ X_b ' $,by,X sub b prime,1,7,0,0,1,0,0,1.7000000000000002,0,-0.7477609758675752,-0.008661994214503876
be a decreasing basis of,$ G $,-invariant Stein open neighborhoods of~,G,1,3,0,0,0,0,0,0.30000000000000004,0,-1.5320667200554465,-0.01481389381748181
The,$ \dot { U } _ { q } $,-action and the,dot U sub q,1,20,1,1,1,0,4,6.5,0,2.860161838168614,0.3217671412038777
The polar-coordinate plot shows the angular dependence of the nonlinear response in regime,$ C $,. The bottom panels show the schematic diagram of a possible carrier occupation . },C,1,3,0,0,0,0,0,0.30000000000000004,0,-1.5320667200554465,-0.01481389381748181
with,$ P+ ( A-P ) $,", we decompose the numerator of",P plus open parenthesis A minus P close parenthesis.,1,12,0,0,0,0,0,2.2,2,-0.17707652151882203,-0.5761895866343782
be operators on a Hilbert space satisfying,"$ \left [ a_+ , a_- \right ] = 0 $",. For,"Left bracket, a sub plus, comma, a sub minus, right bracket, equals zero.",1,32,2,0,2,0,0,9.7,3,3.62015842603156,-0.8132301472160699
,$ = $,,equals,1,3,0,0,0,0,0,0.8,1,-1.0948621645734855,-0.2962484560406224
Note that the inverse of an,$ \eta $,-quasisymmetry is itself an,eta.,1,6,1,0,0,0,0,2.1,0,-0.796550964066675,0.0007333968571364458
&,$ - $,&,minus,1,3,0,0,0,0,0,0.8,1,-1.0948621645734855,-0.2962484560406224
for,$ X $,and a measure,X,1,3,0,0,0,0,0,0.30000000000000004,0,-1.5320667200554465,-0.01481389381748181
where,$ N $,"is the total number of particles ,",N,1,3,0,0,0,0,0,0.30000000000000004,0,-1.5320667200554465,-0.01481389381748181
and,$ c_M ( \ell_2 ) $,": if this arrow exists , let","c sub M, open parenthesis, ell sub 2, close parenthesis.",1,16,1,0,2,0,0,5.1,0,0.8788563215474458,0.013369069758511144
axis is,$ \Tilde { \alpha } $,because the original experiments do not provide the detailed information of particle and boundary frictional coefficients and we simply neglect the part in,Tilde alpha.,1,19,2,1,0,0,2,6.9,0,2.1894118900539916,0.24740996311207353
Their collective,$ p $,"-value must be smaller , so their collective significance is higher . Within LQC , there have been two different proposals to account for these anomalies , which we summarize",p,1,3,0,0,0,0,0,0.30000000000000004,0,-1.5320667200554465,-0.01481389381748181
выходящем из,$ A $,. В этом случае начальники,A,1,3,0,0,0,0,0,0.30000000000000004,0,-1.5320667200554465,-0.01481389381748181
and therefor the action of,$ G_K $,on,G sub K.,1,5,0,0,1,0,0,1.5,0,-0.8545567731059536,-0.008993867909922706
,$ \pi $,",",pi.,1,5,1,0,0,0,0,2.0,0,-0.8499488626858642,0.0005674600094270377
Our assumption that,$ \kappa $,is supported on,kappa.,1,8,1,0,0,0,0,2.3,0,-0.6897551668282966,0.001065270552555276
if,$ a $,is Conant-independent from,a,1,3,0,0,0,0,0,0.30000000000000004,0,-1.5320667200554465,-0.01481389381748181
denoted by,$ E_i $,", in which among",E sub i.,1,5,0,0,1,0,0,1.5,0,-0.8545567731059536,-0.008993867909922706
and,$ 0.056 $,". Therefore , it can be deduced that the critical strain amplitude for the yielding transition is between",0.056: None,1,7,0,0,0,0,0,0.7000000000000001,0,-1.3184751255786897,-0.014150146426644163
the exponential term cuts off the integral to the area around,$ \xi\to0 $,". Thus , the only way the LHS of Eq.~",xi tends to zero.,1,9,2,0,0,0,0,3.9,0,-0.06103520807790374,0.016280687531754708
for a spatially incoherent noise and,$ N^2 $,"for a spatially coherent noise , as discussed above . % Therefore , it is essential to mitigate the heating noise in order to realize the procedure explained in Sec.~",N squared.,1,5,0,0,0,1,0,1.5,0,-0.6248890963946476,-0.2183611910549197
kJ/m,$ ^ { 3 } $,"] , although a typical magnetic field of say",Three to the power of three.,1,9,0,1,0,1,2,3.9,0,1.3051706100221119,0.011772463439142612
larger than,$ s $,and smaller than,s,1,3,0,0,0,0,0,0.30000000000000004,0,-1.5320667200554465,-0.01481389381748181
which converts between distance in the metric,$ d_ { \mc { X } } $,and differences in Mal'cev coordinates . This completes the proof .,dee sub m c X,1,18,1,2,1,0,4,8.3,0,3.8478741929547158,0.46715260544823906
and,$ z $,in,z,1,3,0,0,0,0,0,0.30000000000000004,0,-1.5320667200554465,-0.01481389381748181
and,$ n $,is the number of features . We can approximate,n,1,3,0,0,0,0,0,0.30000000000000004,0,-1.5320667200554465,-0.01481389381748181
be the maximal subsequence of,$ x $,such that,x,1,3,0,0,0,0,0,0.30000000000000004,0,-1.5320667200554465,-0.01481389381748181
for the free,$ H_\infty $,-,H infinity.,1,10,1,0,1,0,0,3.5,0,-0.012245219878803807,0.00688529646011438
-density,$ \nu $,on,nu.,1,5,1,0,0,0,0,2.0,0,-0.8499488626858642,0.0005674600094270377
The strength of the interaction is tuned by the parameter,$ \beta \geq 0 $,and the Gibbs measure,Beta is greater than or equal to zero.,1,14,2,0,0,0,0,4.4,0,0.20595428501804242,0.01711037177030177
,$ K $,", ranging from",K,1,3,0,0,0,0,0,0.30000000000000004,0,-1.5320667200554465,-0.01481389381748181
and,$ \theta $,respectively ;,Theta.,1,8,1,0,0,0,0,2.3,0,-0.6897551668282966,0.001065270552555276
and,$ y $,are connected by an edge in,y,1,3,0,0,0,0,0,0.30000000000000004,0,-1.5320667200554465,-0.01481389381748181
vanishes at,$ x=0 $,at a finite order,x equals zero.,1,5,0,0,0,0,0,1.0,1,-0.9880663673351072,-0.2959165823452035
making it more difficult to isolate a possible,$ \alpha = \nicefrac { 2 } { 3 } $,"contribution . Finite size effects might further lead to pronounced influences on the observed energies , such that we can not rule out a scaling of the form Eq.~",Alpha equals two-thirds.,1,32,2,1,0,0,4,8.7,1,3.9427490875009346,0.05188514907259983
a so-called mild solution can be obtained for every,$ \phi \in X $,by requiring only that,phi belongs to X.,1,12,2,0,0,0,0,4.2,0,0.0991584877796639,0.016778498074882946
&,$ 0.98 $,&,0.98: None,1,6,0,0,0,0,0,0.6000000000000001,0,-1.371873024197879,-0.014316083274353571
With the reconstructed memory kernel,$ K ( t ) $,and the properties of the thermal fluctuations,K of t.,1,9,0,0,0,0,0,0.9,0,-1.2116793283403113,-0.013818272731225333
at each timestep,"$ t=1 , ... , T $",a new node,"t equals one, ellipsis, T",1,15,0,0,0,0,0,2.0,1,-0.4540873811432153,-0.29425721386810944
is the collection of forests with,$ K $,"connected components ,",K,1,3,0,0,0,0,0,0.30000000000000004,0,-1.5320667200554465,-0.01481389381748181
for,$ \alpha \in \mathcal { A } $,and,Alpha belongs to the set A.,1,27,3,1,0,0,2,9.2,0,3.191917139138709,0.2637869380252389
is the,$ u $,-th row of the hybrid combiner,u,1,3,0,0,0,0,0,0.30000000000000004,0,-1.5320667200554465,-0.01481389381748181
is not true for,$ r=5 $,and,r equals 5,1,5,0,0,0,0,0,1.0,1,-0.9880663673351072,-0.2959165823452035
The bulk of the H,$ \alpha $,emission in the spectrum appears to be associated with the brighter star . Evidence is presented that the period of the system has been stable over timescales of many decades,Alpha.,1,8,1,0,0,0,0,2.3,0,-0.6897551668282966,0.001065270552555276
by adjusting the constant,$ C_3 $,", it suffices to prove the result for",C sub 3.,1,5,0,0,1,0,0,1.5,0,-0.8545567731059536,-0.008993867909922706
as,$ v $,and,v,1,3,0,0,0,0,0,0.30000000000000004,0,-1.5320667200554465,-0.01481389381748181
For,$ t\in \RR $,", let",t belongs to the set of real numbers.,1,10,2,0,0,0,0,4.0,0,-0.007637309458714475,0.016446624379464116
and discards all information outside of,$ E $,. Recall that the Poisson information measure,E,1,3,0,0,0,0,0,0.30000000000000004,0,-1.5320667200554465,-0.01481389381748181
& Error of the,$ \ell $,-th error category for a row,lowercase L.,1,6,1,0,0,0,0,2.1,0,-0.796550964066675,0.0007333968571364458
The functions,$ k_1 $,",",k sub 1,1,5,0,0,1,0,0,1.5,0,-0.8545567731059536,-0.008993867909922706
for,$ \widehat { A } $,such that,A hat.,1,16,1,1,0,0,2,5.1,0,1.4538961340652197,0.23186267243745526
superradiance can only constrain large,$ f_a $,. We show the excluded region found in,f sub a.,1,5,0,0,1,0,0,1.5,0,-0.8545567731059536,-0.008993867909922706
for,$ 50\ % $,"of long GRBs , and localisations within a few square degrees for bursts with an observed time-averaged flux higher than",Fifty percent.,1,7,0,0,0,0,0,0.7000000000000001,0,-1.3184751255786897,-0.014150146426644163
and we let,$ \Omega $,"represent the remaining indices ; that is ,",Omega.,1,8,1,0,0,0,0,2.3,0,-0.6897551668282966,0.001065270552555276
% &,$ n^ { 11 } $,% &,n to the power of 11,1,11,0,1,0,1,2,4.1,0,1.4119664072604905,0.012104337134561435
C09 discovered that,$ z\sim3 $,LBGs segregate in colour -- magnitude space according to their net,z is approximately distributed as 3.,1,8,1,0,0,0,0,2.3,0,-0.6897551668282966,0.001065270552555276
Each branch will be diffeomorphic to a circle,$ S^1 $,with the parametrization below :,S one.,1,5,0,0,0,1,0,1.5,0,-0.6248890963946476,-0.2183611910549197
with,$ |A|\ll p^ { \frac { 2 } { 3 } } $,",",Absolute value of A is much less than p to the power of two-thirds.,1,33,2,2,0,1,6,11.3,0,6.0757923690005855,0.3590763843138177
with,$ z $,being a complex number and,z,1,3,0,0,0,0,0,0.30000000000000004,0,-1.5320667200554465,-0.01481389381748181
to introduce a generator~,$ c $,and a relation,c,1,3,0,0,0,0,0,0.30000000000000004,0,-1.5320667200554465,-0.01481389381748181
we average the interference pattern of unknown discrete vortex having TC,$ \neq0 $,with the interference pattern of known discrete vortex having TC,not equal to zero.,1,7,1,0,0,0,0,2.2,0,-0.7431530654474858,0.0008993337048458608
is not boundary-parallel in,$ M_P $,". Thus , by Lemma~",M sub P.,1,5,0,0,1,0,0,1.5,0,-0.8545567731059536,-0.008993867909922706
denotes the total number of particles and,$ V $,denotes the volume ) . All dimensional observables reported below and in the manuscript should be understood as expressed in terms of the aforementioned microscopic units,V,1,3,0,0,0,0,0,0.30000000000000004,0,-1.5320667200554465,-0.01481389381748181
The constraint is consistent with zero within 1,$ \sigma $,error . The blue region shows the posterior of the 21cm global signal from random samples within priors,Sigma.,1,8,1,0,0,0,0,2.3,0,-0.6897551668282966,0.001065270552555276
The curves are obtained numerically by further minimizing,$ \gamma_1/2 $,in,Gamma one-half.,1,12,1,0,1,0,0,4.2,1,0.5317551328415355,-0.27421739206760737
in,"$ W^ { 1,2 } ( \Omega ) $",as,"W raised to the power of 1,2, in parentheses Omega.",1,23,1,1,0,1,2,6.800000000000001,0,2.6280632508219646,0.029145059438564408
As an operator of,$ L^2 ( \R^d ) $,"with domain the Schwartz space ,",L squared of the set of real numbers raised to the power of d.,1,14,1,0,0,2,0,4.9,0,1.2313958777316796,-0.4056974502269017
But what if the smallest distance between any two occupied cells of the considered structure is larger than,$ 1 $,? Then,one,1,3,0,0,0,0,0,0.30000000000000004,0,-1.5320667200554465,-0.01481389381748181
,"$ , the outcome being a sphere-shaped ensemble of $",,The outcome is a minus the complement of the ensemble.,1,49,0,0,0,0,0,5.4,1,1.3614411719092179,-0.2886153610459894
for,$ 8 $,lane pairs can be derived .,eight,1,3,0,0,0,0,0,0.30000000000000004,0,-1.5320667200554465,-0.01481389381748181
,$ \beta^ * $,"is the frequency factor ,",Beta star.,1,10,1,0,0,1,0,4.0,1,0.6546270123144631,-0.4839165889080232
76 &,$ \pm 1 $,& 0,Plus or minus one.,1,7,1,0,0,0,0,2.2,0,-0.7431530654474858,0.0008993337048458608
where,$ k $,is the rank of the design matrix,k,1,3,0,0,0,0,0,0.30000000000000004,0,-1.5320667200554465,-0.01481389381748181
with respect to,$ \psi $,that makes the operator 's distribution closer to the learned policies ' distribution by solving below :,Psi.,1,6,1,0,0,0,0,2.1,0,-0.796550964066675,0.0007333968571364458
For any natural number,$ n $,", write",n,1,3,0,0,0,0,0,0.30000000000000004,0,-1.5320667200554465,-0.01481389381748181
random variable with degree of freedom,$ r $,". Finally , in light of Algorithm",r,1,3,0,0,0,0,0,0.30000000000000004,0,-1.5320667200554465,-0.01481389381748181
and increasing events,$ A_1 \in \sigma ( I_1 ) $,and,A sub 1 belongs to the set sigma of I sub 1.,1,24,2,0,2,0,0,7.4,0,1.8813615706321636,0.02974604467167646
where,$ \eta $,runs over the set of semipositive closed real,eta.,1,6,1,0,0,0,0,2.1,0,-0.796550964066675,0.0007333968571364458
Each panel shows the measured value as function of,$ \tau $,. The top row shows results for the effective radius,Tau.,1,6,1,0,0,0,0,2.1,0,-0.796550964066675,0.0007333968571364458
the lower bound becomes,$ -\frac { 1 } { 3 } $,", which this latter channel saturates . Thus for both choices of post-measurement states , we have a valid depolarizing channel : however it is worth remarking that the latter",Negative one-third.,1,20,1,1,0,0,4,6.0,1,2.7266522439394603,0.03484442676859683
we must require that the,$ Y_i $,"'s have a bounded support . In particular , consider unidimensional data on",Y sub i.,1,5,0,0,1,0,0,1.5,0,-0.8545567731059536,-0.008993867909922706
input,$ P $,into the off-the-shelf 3D object detection model to obtain the initial box,P,1,3,0,0,0,0,0,0.30000000000000004,0,-1.5320667200554465,-0.01481389381748181
For any,$ f ( n ) = o ( \sqrt { n } ) $,", if the counting depth is",f of n equals little o of square root of n.,1,29,1,1,0,0,2,6.9,1,2.5852733715966405,-0.047414710765462977
:,$ m=0 $,. Set,m equals zero.,1,5,0,0,0,0,0,1.0,1,-0.9880663673351072,-0.2959165823452035
for Liver-HCC to,$ 0.50 $,for ColoRect-AdenoCA . This scenario is thus referred to as,0.50: None,1,6,0,0,0,0,0,0.6000000000000001,0,-1.371873024197879,-0.014316083274353571
&,$ -0.09 $,&,Negative zero point zero nine.,1,7,0,0,0,0,0,1.2000000000000002,1,-0.8812705700967288,-0.2955847086497847
has only the,$ x $,component and,x,1,3,0,0,0,0,0,0.30000000000000004,0,-1.5320667200554465,-0.01481389381748181
LO QCD corrections decrease the LO result by,$ -0.667\ % $,". Combining with the other higher-order corrections , such as the EW corrections and off-shell",negative zero point six six six percent.,1,11,0,0,0,0,0,1.6,1,-0.6676789756199721,-0.29492096125894707
for each,$ t < N $,",",t is less than N.,1,7,0,0,0,0,0,1.2000000000000002,1,-0.8812705700967288,-0.2955847086497847
96 &,$ - $,157.65 & 4.955 &,minus,1,3,0,0,0,0,0,0.8,1,-1.0948621645734855,-0.2962484560406224
\State Compute an approximate,$ 2 $,-ve dominating set,two,1,3,0,0,0,0,0,0.30000000000000004,0,-1.5320667200554465,-0.01481389381748181
=,$ \phi_ { j } $,,phi sub j.,1,13,1,1,1,0,2,5.8,0,1.8644165879187666,0.2368530141064673
with,"$ n=1 , \ldots , N $","are the modes on the left and right ends of the stripes , respectively ,","n equals 1, dot dot dot, N.",1,18,1,0,0,0,0,3.8,1,0.2814283748455561,-0.27870992319349114
can be deduced from the,$ \kappa $,-first-order deduction-system . For the classical version we use the,kappa.,1,8,1,0,0,0,0,2.3,0,-0.6897551668282966,0.001065270552555276
curve from 0 to,$ \infty $,in the upper half-plane,Infinity.,1,8,1,0,0,0,0,2.3,0,-0.6897551668282966,0.001065270552555276
Let,$ \gamma $,be a,Gamma.,1,8,1,0,0,0,0,2.3,0,-0.6897551668282966,0.001065270552555276
denoted by,"$ ( ( Y_i , D_i , X_i ) ) _ { i\in [ n ] } $",", where","Open parenthesis, Y sub i, comma, D sub i, comma, X sub i, close parenthesis, sub i in the interval from n.",1,42,1,1,4,0,2,11.7,0,5.125098097008597,0.25812963932646116
The initial guess is two small discs near the boundary,$ \partial\Omega $,". Note that in this case , we choose the boundary data",Partial omega.,1,16,2,0,0,0,0,4.6,0,0.31275008225642065,0.017442245465720593
and,$ b_j $,associated with directed edge,bj,1,5,0,0,1,0,0,1.5,0,-0.8545567731059536,-0.008993867909922706
has a unique solution in,$ D $,for all,D,1,3,0,0,0,0,0,0.30000000000000004,0,-1.5320667200554465,-0.01481389381748181
-shallow minor,$ H $,of,H,1,3,0,0,0,0,0,0.30000000000000004,0,-1.5320667200554465,-0.01481389381748181
is the PDF of stochastic variable,$ w_k $,",",w sub k,1,5,0,0,1,0,0,1.5,0,-0.8545567731059536,-0.008993867909922706
Now sample,$ k $,negative tokens,k,1,3,0,0,0,0,0,0.30000000000000004,0,-1.5320667200554465,-0.01481389381748181
