context_before,equation,context_after,spoken_English,latex_num_expressions,latex_total_length,latex_total_commands,latex_total_nesting_depth,latex_total_subscripts,latex_total_superscripts,latex_total_braces,latex_avg_complexity_score,latex_total_operators,pca_1,pca_2
goes identically to,$ 0 $,", actually predicting a vanishing first order contribution in",zero,1,3,0,0,0,0,0,0.30000000000000004,0,-1.5320667200554465,-0.01481389381748181
\eeq Now let us consider just the component at fixed,$ y $,,y,1,3,0,0,0,0,0,0.30000000000000004,0,-1.5320667200554465,-0.01481389381748181
59070,$ & $,0.59071,and,1,3,0,0,0,0,0,0.30000000000000004,0,-1.5320667200554465,-0.01481389381748181
,$ \overline { b } _1 $,is complete to,b bar sub 1,1,20,1,1,1,0,2,6.5,0,2.2382018782530912,0.2380145720404332
we can ignore contributions from given cumulant orders by setting the corresponding parameter,$ \alpha_ { n } $,"to zero . In this way , we create a `` single order '' OSP for order",Alpha sub n.,1,15,1,1,1,0,2,6.0,0,1.9712123851571448,0.23718488780188612
where,"$ \widetilde { A } _ { m-1 } =\widetilde { A } _ { m-1,0 } $",denotes the resolved type,Widetilde A sub m minus 1 equals widetilde A sub m minus 1.,1,58,2,1,2,0,8,12.8,3,8.386932195113435,-0.3303149497369525
showing that the CBS width,$ \Delta k ( t ) $,at the transition has the same time dependence as in Eq.,Delta k of t.,1,16,1,0,0,0,0,3.1,0,-0.2625719778747831,0.0023927653342305684
We define,$ \eta $,as,eta.,1,6,1,0,0,0,0,2.1,0,-0.796550964066675,0.0007333968571364458
0,$ ( $,lim_ { s,opening parenthesis,1,3,0,0,0,0,0,0.30000000000000004,0,-1.5320667200554465,-0.01481389381748181
and,"$ ( Y_ { 2 } , \delta_ { \Phi_ { 2 } } ) $",be any dpspcs . Then their cartesian product,"Open parenthesis, capital Y sub 2, comma, delta sub capital Phi sub 2, close parenthesis.",1,40,2,2,3,0,6,14.0,0,7.361338282045834,0.5805815698170612
for different choices in the masses of the scalars,$ A_0 $,and,A zero.,1,5,0,0,1,0,0,1.5,0,-0.8545567731059536,-0.008993867909922706
are all zero but the,$ k $,"-row entry that is equal to 1 . % When a point-like transducer model is assumed and a nearest-neighbor interpolation method is employed , %",k,1,3,0,0,0,0,0,0.30000000000000004,0,-1.5320667200554465,-0.01481389381748181
&,$ 1.82\pm 1.49 $,& 15,One point eight two plus or minus one point four nine.,1,14,1,0,0,0,0,2.9000000000000004,0,-0.36936777511316143,0.0020608916388117383
% is computed as a suitable transformation of GLP points from,"$ [ 0,1 ] ^d $",", see Section~",Zero to one raised to the power of d.,1,12,0,0,0,1,0,2.2,0,-0.25110380606032323,-0.2171996331209538
We used,$ 1024 $,Chebyshev moments with the Jackson kernel to obtain an energy resolution of,One thousand twenty-four.,1,6,0,0,0,0,0,0.6000000000000001,0,-1.371873024197879,-0.014316083274353571
for the statistical population of a pseudospin of,$ 1/2 $,in the presence of the effective ` Zeeman ' splitting,One-half.,1,5,0,0,0,0,0,1.0,1,-0.9880663673351072,-0.2959165823452035
Otherwise for,$ 0 \leq t \leq n $,",","0 is less than or equal to t, which is less than or equal to n.",1,17,2,0,0,0,0,3.2,0,0.16222839417199358,0.015481407158544371
,$ 10 $,] & [,Ten.,1,4,0,0,0,0,0,0.4,0,-1.4786688214362573,-0.014647956969772401
be the cosine similarity between node,$ v_i $,and its neighbor,v sub i,1,5,0,0,1,0,0,1.5,0,-0.8545567731059536,-0.008993867909922706
parameterized by,$ k_0 $,". Besides these leading behaviors , the more detailed envelope behavior and subleading phase shifts are more complicated and depend on the nature of the sharp feature , but correlations",k sub zero,1,5,0,0,1,0,0,1.5,0,-0.8545567731059536,-0.008993867909922706
is the subfile that is not cached by user,$ j $,", but is requested by it . In other words , considering each subset of",j,1,3,0,0,0,0,0,0.30000000000000004,0,-1.5320667200554465,-0.01481389381748181
and,$ D=\bm { d } _ { k } $,to,D equals d sub k.,1,21,1,1,1,0,4,7.1,1,3.350764292269764,0.04049851582844654
decrease by the increase of the spatial range,$ \alpha_s $,and the temporal delay,Alpha s.,1,10,1,0,1,0,0,3.5,0,-0.012245219878803807,0.00688529646011438
Perhaps the simplest task that one may consider solving using quantile clipped SGD is the estimation of the mean of a random vector,$ X $,such that,X,1,3,0,0,0,0,0,0.30000000000000004,0,-1.5320667200554465,-0.01481389381748181
Let,$ P $,be a lattice polytope in the lattice . Let,P,1,3,0,0,0,0,0,0.30000000000000004,0,-1.5320667200554465,-0.01481389381748181
target smoothing factor,$ \tau $,", discount factor",Tau.,1,6,1,0,0,0,0,2.1,0,-0.796550964066675,0.0007333968571364458
where,$ S $,is a subset of,S,1,3,0,0,0,0,0,0.30000000000000004,0,-1.5320667200554465,-0.01481389381748181
the damping rate,$ \Gamma $,is directly proportional to the gas pressure,Gamma.,1,8,1,0,0,0,0,2.3,0,-0.6897551668282966,0.001065270552555276
,$ J ' $,". This is qualitatively similar to cuprates which have , however , a considerably larger",J prime.,1,5,0,0,0,0,0,0.5,0,-1.4252709228170681,-0.014482020122062993
theories admits the following decomposition in terms of the characters,$ R_n $,,R sub n.,1,5,0,0,1,0,0,1.5,0,-0.8545567731059536,-0.008993867909922706
is moderate with decreasing,$ L $,". In conclusion , kurtosis shows a slight change for finite volumes but this effect is most probably originated from the CEP movement towards the chemical potential axis . The",L,1,3,0,0,0,0,0,0.30000000000000004,0,-1.5320667200554465,-0.01481389381748181
and monotonically decreases with,$ z $,in the interval (,z,1,3,0,0,0,0,0,0.30000000000000004,0,-1.5320667200554465,-0.01481389381748181
with respect to,$ S $,. If,S,1,3,0,0,0,0,0,0.30000000000000004,0,-1.5320667200554465,-0.01481389381748181
at the granularity,$ g_j $,. We utilize the hidden vector,g sub j,1,5,0,0,1,0,0,1.5,0,-0.8545567731059536,-0.008993867909922706
We posit that the global structure imposed by the physics-informed filter,$ G ( \cdot ) $,"exhibits a degree of control over the usually erratic mean predictions which can result when attempting to extrapolate with Fourier feature-based GPs experiencing variance starvation . However , the filters",G of center dot.,1,13,1,0,0,0,0,2.8,0,-0.4227656737323507,0.0018949547911023372
computing D-EDI necessitates merely,$ 5 $,"evaluations , compared to",five,1,3,0,0,0,0,0,0.30000000000000004,0,-1.5320667200554465,-0.01481389381748181
~ & ~ &,$ S_ { \alpha } \uparrow $,&,S alpha up arrow.,1,24,2,1,1,0,2,8.4,0,3.0271155328610515,0.25372779956276087
stands for the residue of,$ g ( s ) $,at,g of s,1,9,0,0,0,0,0,0.9,0,-1.2116793283403113,-0.013818272731225333
th entry is the weight of the edge connecting node,$ i $,to node,i,1,3,0,0,0,0,0,0.30000000000000004,0,-1.5320667200554465,-0.01481389381748181
Transition in the limit of small,$ C $,and large,C,1,3,0,0,0,0,0,0.30000000000000004,0,-1.5320667200554465,-0.01481389381748181
with batch size,$ 5 $,.,five,1,3,0,0,0,0,0,0.30000000000000004,0,-1.5320667200554465,-0.01481389381748181
distribution are faithful descriptors of the error on,$ \alpha $,measured by fitting,Alpha.,1,8,1,0,0,0,0,2.3,0,-0.6897551668282966,0.001065270552555276
em a,$ \pi_1 $,-injective path-isometric map,Pi sub 1.,1,7,1,0,1,0,0,3.2,0,-0.17243891573637143,0.0063874859169861485
and,$ \mathrm { R } $,is a rotation matrix . The lengthscales,R.,1,15,1,1,0,0,2,5.0,0,1.4004982354460305,0.23169673558974585
31,$ \pm $,4.54 & 60.59,Plus or minus.,1,5,1,0,0,0,0,2.0,0,-0.8499488626858642,0.0005674600094270377
in,"$ x_1 , \ldots , x_4 $",by choosing an appropriate coefficient function,"x sub 1, ellipsis, x sub 4",1,20,1,0,2,0,0,5.5,0,1.0924479160242027,0.01403281714934879
when,$ \lambda=1/2 $,", the corresponding eigenvector",Lambda equals one-half.,1,13,1,0,0,0,0,3.8,2,0.4516434372315711,-0.5609741696551788
erg s,$ ^ { -1 } $,". While all three jet models effectively suppressed star formation and halted the cooling flow at sufficiently high energy fluxes , they displayed noteworthy differences in ion distributions . The",to the power of negative one.,1,10,0,1,0,1,2,4.5,1,1.795773064123262,-0.2694961619362885
but all these solutions execute the same,$ P_ { j_0 } $,". The obtained find is not unique when the initial finds are not both unique . However , in practice , if the outer find is unique and the inner",P sub j sub zero,1,12,0,1,2,0,2,5.2,0,1.806410778879488,0.22712574933940816
means,$ a_ { 1 } =b_ { 1 } $,",",a sub one equals b sub one,1,20,0,1,2,0,4,6.5,1,3.2927584832304855,0.03077125106138739
&,$ 0 $,&,zero,1,3,0,0,0,0,0,0.30000000000000004,0,-1.5320667200554465,-0.01481389381748181
and,$ S_k $,.,S subscript k.,1,5,0,0,1,0,0,1.5,0,-0.8545567731059536,-0.008993867909922706
we can ask how efficiently,$ \ket { S } $,"will mix with the problem 's excited states , as these rates ultimately determine the algorithm 's efficacy as an approximator . Calculating them directly is very difficult , but",ket S.,1,12,1,1,0,0,2,4.7,0,1.2403045395884629,0.23119892504661763
We begin by identifying,$ \Gamma $,-Cartan subalgebras,Gamma.,1,8,1,0,0,0,0,2.3,0,-0.6897551668282966,0.001065270552555276
for any,$ t\geq 0 $,and all gradient flows in,t greater than or equal to zero,1,9,1,0,0,0,0,2.4,0,-0.6363572682091074,0.001231207400264684
For,$ a $,an octonion with,a,1,3,0,0,0,0,0,0.30000000000000004,0,-1.5320667200554465,-0.01481389381748181
of a given distribution,$ \mu $,". That is , the condition will still be satisfied under small perturbations of",mu.,1,5,1,0,0,0,0,2.0,0,-0.8499488626858642,0.0005674600094270377
The third,$ \vec { Z } ^ { ( 1 ) } _ { : :3 } $,and fourth slices,"Vector Z superscript 1, subscript 3",1,35,1,1,1,1,6,9.0,0,5.083472103794395,0.20412959215010668
being an,$ s $,qubit register and,s,1,3,0,0,0,0,0,0.30000000000000004,0,-1.5320667200554465,-0.01481389381748181
the initial value of,"$ \alpha_ { 2,10 } $","is typically relatively high . As massive stars migrate to the center ,",Alpha sub 2 comma 10.,1,18,1,1,1,0,2,6.3,0,2.131406081014713,0.23768269834501438
captures variations in the drawn and actual width and that,$ V $,"captures the effect of process parameters that slowly vary across the wafer . In local optimization , sequential groups of parameters are extracted independently of one another . Parameters which",V,1,3,0,0,0,0,0,0.30000000000000004,0,-1.5320667200554465,-0.01481389381748181
Any orthogonalizable linear functor,$ F $,defines a functor,F,1,3,0,0,0,0,0,0.30000000000000004,0,-1.5320667200554465,-0.01481389381748181
under,$ f $,.,f,1,3,0,0,0,0,0,0.30000000000000004,0,-1.5320667200554465,-0.01481389381748181
and,$ M_2 $,are equivalent . By the proof of Theorem,M sub 2.,1,5,0,0,1,0,0,1.5,0,-0.8545567731059536,-0.008993867909922706
This linear growth in rank with the number of samples,$ N $,leads to scaling of downstream tensor operations with,N,1,3,0,0,0,0,0,0.30000000000000004,0,-1.5320667200554465,-0.01481389381748181
be a sequence of non-negative real number which converges to a non-negative real number,$ \epsilon $,. If,epsilon.,1,10,1,0,0,0,0,2.5,0,-0.5829593695899182,0.0013971442479740921
Denote,"$ x : =\left ( x^1 , \ldots , x^N\right ) $",and,"x colon equals left parenthesis x raised to the power of 1, ellipsis, x raised to the power of N right parenthesis.",1,41,3,0,0,2,0,11.100000000000001,1,4.260987816194157,-0.652552757298908
then so does,$ F $,: The classes are given by,F,1,3,0,0,0,0,0,0.30000000000000004,0,-1.5320667200554465,-0.01481389381748181
the wave function transformation to generate starting vector for the diagonalization step by,$ \rm { StVec } $,", and all other utility components by",St Vec,1,15,1,1,0,0,2,5.0,0,1.4004982354460305,0.23169673558974585
be vector bundles over,$ M $,and,M,1,3,0,0,0,0,0,0.30000000000000004,0,-1.5320667200554465,-0.01481389381748181
is defined in polar coordinates by,$ \rho ( \varphi ) = \rho_0 ( 1 + \epsilon \cos\varphi ) $,where,Rho of phi equals rho sub zero times the quantity one plus epsilon times cosine of phi.,1,56,6,0,1,0,0,13.600000000000001,2,5.7872383548166075,-0.47735688264385495
we derive explicit expressions for the parameter,$ \gamma $,that maximizes the cost function in the weighted case . Our analysis of MaxCut at,Gamma.,1,8,1,0,0,0,0,2.3,0,-0.6897551668282966,0.001065270552555276
&,$ 0.54\pm0.04 $,&,0.54 plus or minus 0.04,1,13,1,0,0,0,0,2.8,0,-0.4227656737323507,0.0018949547911023372
to,$ M-1 $,", where",M minus one.,1,5,0,0,0,0,0,1.0,1,-0.9880663673351072,-0.2959165823452035
and abelian,$ 4 $,-division field .,four,1,3,0,0,0,0,0,0.30000000000000004,0,-1.5320667200554465,-0.01481389381748181
The two,$ b $,-quarks can pair with the leptons in two ways . If the correct pairs are such that,b,1,3,0,0,0,0,0,0.30000000000000004,0,-1.5320667200554465,-0.01481389381748181
\ \-\-\ cycle ;,$ & $,,and,1,3,0,0,0,0,0,0.30000000000000004,0,-1.5320667200554465,-0.01481389381748181
of node,$ i \in \mathcal { V } $,on the graph,i belongs to the set V.,1,22,2,1,0,0,2,7.2,0,2.3496055859115588,0.24790777365520175
& 1 & 1 & 0 & 8 &,$ + $,,plus,1,3,0,0,0,0,0,0.8,1,-1.0948621645734855,-0.2962484560406224
&,$ 146.0 $,&,1460.0,1,7,0,0,0,0,0,0.7000000000000001,0,-1.3184751255786897,-0.014150146426644163
-3i-2,"$ , $",e ( c ),comma,1,3,0,0,0,0,0,0.30000000000000004,0,-1.5320667200554465,-0.01481389381748181
the,"$ ( i , j ) $",element of,"open parenthesis i, comma j, close parenthesis.",1,11,0,0,0,0,0,1.1,0,-1.104883531101933,-0.013486399035806503
Thus,$ W=\emptyset $,and,W equals empty set.,1,13,1,0,0,0,0,3.3,1,0.014438881749610187,-0.2795396074320382
shows two exemplary individual cases of EBH spin,$ a $,"evolution . By convention , the sign of",a,1,3,0,0,0,0,0,0.30000000000000004,0,-1.5320667200554465,-0.01481389381748181
for the density,$ \rho $,can be rewritten as,rho.,1,6,1,0,0,0,0,2.1,0,-0.796550964066675,0.0007333968571364458
groups,$ \mathcal { G } $,", and",G,1,16,1,1,0,0,2,5.1,0,1.4538961340652197,0.23186267243745526
after,$ T $,iterations with,T,1,3,0,0,0,0,0,0.30000000000000004,0,-1.5320667200554465,-0.01481389381748181
the pulsation phase is denoted,$ \varphi $,", where",phi.,1,9,1,0,0,0,0,2.4,0,-0.6363572682091074,0.001231207400264684
be the inverse branch of,$ F $,which maps,F,1,3,0,0,0,0,0,0.30000000000000004,0,-1.5320667200554465,-0.01481389381748181
and derive the closed form of the induced metric tensor on,$ \Theta $,", which plays an essential role in characterizing the SVGD dynamics .",Theta.,1,8,1,0,0,0,0,2.3,0,-0.6897551668282966,0.001065270552555276
over,$ S $,is,S,1,3,0,0,0,0,0,0.30000000000000004,0,-1.5320667200554465,-0.01481389381748181
Recall that an SLP,$ X $,"is an acyclic context-free grammar in Chomsky normal form where furthermore each non-terminal has only one production rule , i.e . , the grammar is deterministic ( see survey~",X,1,3,0,0,0,0,0,0.30000000000000004,0,-1.5320667200554465,-0.01481389381748181
The slope of the line tangent to the curve,$ \eta^ * $,at the point,Eta star.,1,9,1,0,0,1,0,3.9,1,0.6012291136952739,-0.4840825257557326
for,"$ n=10,20 , \dots,50 $",", under the NSE utility function . For the Bayesian optimal design , we assume the prior distribution ,","n equals 10, 20, dot dot dot, 50.",1,20,1,0,0,0,0,4.0,1,0.38822417208393467,-0.2783780494980723
000 for,$ \beta=0.99 $,", and 4,000 for",Beta equals zero point nine nine.,1,12,1,0,0,0,0,3.2,1,-0.038959016869578963,-0.27970554427974764
that of localizing information on compact regions on,$ \Sigma $,: to what extent is it possible to find two initial data satisfying the constraints,Sigma.,1,8,1,0,0,0,0,2.3,0,-0.6897551668282966,0.001065270552555276
the DCR shift only occurs in the,$ \delta $,"direction , not the RA direction .",delta.,1,8,1,0,0,0,0,2.3,0,-0.6897551668282966,0.001065270552555276
Given a matrix,$ M $,we define the sequence space,M,1,3,0,0,0,0,0,0.30000000000000004,0,-1.5320667200554465,-0.01481389381748181
denote the random variable obtained by sampling,$ Z \sim p ( z ) $,and computing,Z follows the probability distribution p of z.,1,16,1,0,0,0,0,3.1,0,-0.2625719778747831,0.0023927653342305684
with,$ \sum_ { j=1 } ^ { 16 } \alpha_j = 1 $,. We consider sufficient link capacity for each pair of ingress and egress nodes . We evaluate the,"Sum from j equals 1 to 16, alpha sub j equals 1.",1,37,2,1,2,1,4,12.7,2,6.588753261923491,-0.42162259542056985
-mer,$ p \in P $,", as shown in the following equation .",p belongs to P.,1,9,1,0,0,0,0,2.4,0,-0.6363572682091074,0.001231207400264684
we specify the wino type model by setting,$ M_1 < M_2 < \mu $,". In this model ,",M sub 1 is less than M sub 2 is less than mu,1,17,1,0,2,0,0,6.2,2,1.8066633311305569,-0.5493341178400606
and,$ \hat { \Theta } $,is given by,Theta hat symbol.,1,17,2,1,0,0,2,6.7,0,2.0826160928156128,0.2470780894166547
Denoting by,$ A $,the degenerate skew-symmetric matrix corresponding to the infinitesimal generator of the group,A,1,3,0,0,0,0,0,0.30000000000000004,0,-1.5320667200554465,-0.01481389381748181
The time-dependant linear matter density perturbation,$ \delta = \delta \rho / \rho $,is linked to,Delta equals delta rho divided by rho.,1,29,4,0,0,0,0,6.9,2,2.6241368221249775,-0.5174242900071294
,$ i=1 $,to,i equals one.,1,5,0,0,0,0,0,1.0,1,-0.9880663673351072,-0.2959165823452035
\eeqn which is,$ K $,"-invariant , where",K,1,3,0,0,0,0,0,0.30000000000000004,0,-1.5320667200554465,-0.01481389381748181
but need to care if,$ \Delta=0 $,or not . By keeping the leading low,Delta equals zero.,1,10,1,0,0,0,0,3.0,1,-0.14575481410795735,-0.28003741797516646
1,"$ -core , $",2,minus dot,1,9,0,0,0,0,0,1.4,1,-0.7744747728583504,-0.2952528349543659
then,"$ ( \hat { \Vx } , \Re [ \hat \Vr ] ) $",solves,"Open parenthesis, hat V x, comma, Re open bracket, hat V r, close bracket, close parenthesis.",1,37,5,1,0,0,2,11.7,0,4.672620658889391,0.2934184916104274
for a characteristic set of,"$ h_ { z } = \ { 0.1,0.5,1\ } $","kpc , at","h sub z equals open brace 0.1, 0.5, 1 close brace",1,29,0,1,1,0,4,6.4,1,3.202625421092074,0.026776530478631818
10 \\ & &,$ t $,- 4.08,t,1,3,0,0,0,0,0,0.30000000000000004,0,-1.5320667200554465,-0.01481389381748181
it coincides with the vector of MLEs,"$ ( \hat { \theta } _ { 1 } , \ldots , \hat { \theta } _n ) $",", where each","Open parenthesis, hat theta sub 1, comma, ellipsis, hat theta sub n, close parenthesis.",1,59,5,1,2,0,6,14.4,0,8.028803061061211,0.4734237698563184
&,$ 0.16955 $,&,zero point one six five five,1,9,0,0,0,0,0,0.9,0,-1.2116793283403113,-0.013818272731225333
with controls,$ u_\varepsilon $,and,u sub epsilon.,1,15,1,0,1,0,0,4.0,0,0.25474427321714216,0.007714980698661434
em,$ \sigma $,-compact sets are measurable .,Sigma.,1,8,1,0,0,0,0,2.3,0,-0.6897551668282966,0.001065270552555276
,$ R $,") , and ( 0,0 ,",R,1,3,0,0,0,0,0,0.30000000000000004,0,-1.5320667200554465,-0.01481389381748181
free of squares and unknown polynomials,$ P $,and,P,1,3,0,0,0,0,0,0.30000000000000004,0,-1.5320667200554465,-0.01481389381748181
,$ E \subset B_R $,", and",E is a subset of B sub R.,1,15,1,0,1,0,0,4.0,0,0.25474427321714216,0.007714980698661434
&,$ 44.2 $,,44.2: None,1,6,0,0,0,0,0,0.6000000000000001,0,-1.371873024197879,-0.014316083274353571
This means that,"$ \eta ( \mathcal { P } ( G , v ) ) = \eta ( G ) $",". Thus ,",Eta of the power set of G and v equals eta of G.,1,48,3,1,0,0,2,10.3,1,4.546557978920027,-0.01628972555088973
for the remainder of the paper,"$ B ( x , r ) $",denotes the closed Euclidean ball of center,B of x comma r,1,13,0,0,0,0,0,1.3,0,-0.9980877338635545,-0.013154525340387701
and,$ f_s $,is,f sub s.,1,5,0,0,1,0,0,1.5,0,-0.8545567731059536,-0.008993867909922706
Higher values of,$ L $,"increase the width of the curve , as it is depicted in Fig.",L,1,3,0,0,0,0,0,0.30000000000000004,0,-1.5320667200554465,-0.01481389381748181
,$ ^\textrm { \scriptsize 87 } $,",",Eighty-seven raised to the power of None.,1,29,2,1,0,1,2,8.9,0,3.5237727026683037,0.045190160656310895
,$ ^\textrm { \scriptsize 163 } $,",",One hundred sixty-three.,1,30,2,1,0,1,2,9.0,0,3.577170601287493,0.04535609750402031
% Focusing on the,$ j $,"-th inner region , we first formulate the inner problem of",j,1,3,0,0,0,0,0,0.30000000000000004,0,-1.5320667200554465,-0.01481389381748181
and S\'ersic index,$ n $,. Generally the log-prediction is better than linear-prediction . } } % label { tab : stat_1sersic } %,n,1,3,0,0,0,0,0,0.30000000000000004,0,-1.5320667200554465,-0.01481389381748181
Then,$ F $,is uniformly continuous on,F,1,3,0,0,0,0,0,0.30000000000000004,0,-1.5320667200554465,-0.01481389381748181
-,$ e $,interaction,e,1,3,0,0,0,0,0,0.30000000000000004,0,-1.5320667200554465,-0.01481389381748181
Let,$ \tilde { H } $,be a hyperplane in,H tilde.,1,14,1,1,0,0,2,4.9,0,1.3471003368268413,0.23153079874203641
For large,$ t $,", the asymptotic behavior of the Fourier transform",t,1,3,0,0,0,0,0,0.30000000000000004,0,-1.5320667200554465,-0.01481389381748181
For the purposes of,$ p $,"-adic interpolation , we will consider the modified Hida canonical periods . For any primitive Hida family",p,1,3,0,0,0,0,0,0.30000000000000004,0,-1.5320667200554465,-0.01481389381748181
a positive definite matrix,$ M $,and by,M,1,3,0,0,0,0,0,0.30000000000000004,0,-1.5320667200554465,-0.01481389381748181
% PKLD basis for,$ sl ( 4 ) $,"group is described in Appendix B . There , we represent",ess ell four,1,10,0,0,0,0,0,1.0,0,-1.1582814297211221,-0.013652335883515925
and certain subspaces,$ H $,of the Lie algebra of,H,1,3,0,0,0,0,0,0.30000000000000004,0,-1.5320667200554465,-0.01481389381748181
and private key,$ \lambda $,. %,Lambda.,1,9,1,0,0,0,0,2.4,0,-0.6363572682091074,0.001231207400264684
with,$ d $,. The mesonic mean-field approximation yields,d,1,3,0,0,0,0,0,0.30000000000000004,0,-1.5320667200554465,-0.01481389381748181
,$ u $,) = chaintype (,u,1,3,0,0,0,0,0,0.30000000000000004,0,-1.5320667200554465,-0.01481389381748181
,$ & $,75.44_ {,and,1,3,0,0,0,0,0,0.30000000000000004,0,-1.5320667200554465,-0.01481389381748181
where the,$ \pm $,sign refers to the two halves of the nutation cycle . The direction of,Plus or minus.,1,5,1,0,0,0,0,2.0,0,-0.8499488626858642,0.0005674600094270377
we consider the case of compression in which,$ \lambda=0.8 $,". Combining the results of the previous sections , it follows that the decoupled method converges to",Lambda equals zero point eight.,1,13,1,0,0,0,0,3.3,1,0.014438881749610187,-0.2795396074320382
anticommute the second equality can be fulfilled if either,$ iO_kH_l = P_n $,or,The imaginary unit times the constant O sub k times the height H sub l equals the pressure P sub n.,1,15,0,0,3,0,0,5.0,1,1.2580550679901283,-0.27779275723168856
implies that there is,$ q_1 > 0 $,such that,q sub 1 is greater than zero.,1,9,0,0,1,0,0,2.4,1,-0.20376062314723595,-0.2897646827422256
under the effect of an input voltage,$ V_ { in } $,", which represents the impact of acoustic-Brownian interactions inducing a time varying radio frequency field . The corresponding equation for the system can be written as~",V subscript in,1,11,0,1,1,0,2,4.1,0,1.1822987305491843,0.22147166027955847
where,$ R $,denotes the,R,1,3,0,0,0,0,0,0.30000000000000004,0,-1.5320667200554465,-0.01481389381748181
The resulted,$ \beta $,and,Beta.,1,7,1,0,0,0,0,2.2,0,-0.7431530654474858,0.0008993337048458608
is the rotation number of the component,$ K_i $,. % % % % % % % % % % % % % % % % We are now ready to define our first family of manifolds . For,K sub i.,1,5,0,0,1,0,0,1.5,0,-0.8545567731059536,-0.008993867909922706
Let,$ H $,be a graph with,H,1,3,0,0,0,0,0,0.30000000000000004,0,-1.5320667200554465,-0.01481389381748181
for any value of,$ T $,if,T,1,3,0,0,0,0,0,0.30000000000000004,0,-1.5320667200554465,-0.01481389381748181
18,$ \pm $,75.90 & 315.08,Plus or minus.,1,5,1,0,0,0,0,2.0,0,-0.8499488626858642,0.0005674600094270377
^N,"$ , $",,comma,1,3,0,0,0,0,0,0.30000000000000004,0,-1.5320667200554465,-0.01481389381748181
Given a colored partition,"$ ( R , B ) $",of any,open parenthesis R comma B close parenthesis,1,11,0,0,0,0,0,1.1,0,-1.104883531101933,-0.013486399035806503
we consider the same,$ f_ { \rm esc } ^ { \rm AGN } =0.75 $,", derived for bright QSOs , over the whole luminosity range , i.e . we imply that fainter AGNs resemble scaled-down versions of the most powerful lighthouses in the Universe","f subscript esc, superscript AGN, equals 0.75.",1,36,2,1,1,1,4,9.6,1,5.323517071407609,-0.14796889741216462
One case where this is better understood is that of the quantized,$ A_n $,"singularities , studied by Etingof , Klyuev , Rains , and Stryker",A sub n.,1,5,0,0,1,0,0,1.5,0,-0.8545567731059536,-0.008993867909922706
starting from the south-west most cell of,$ \mu $,", adding a single entry to each tableau-entry in a row from left to right in",mu.,1,5,1,0,0,0,0,2.0,0,-0.8499488626858642,0.0005674600094270377
and,$ \Delta x = L/N $,", where",Delta x equals L over N.,1,16,1,0,0,0,0,4.1,2,0.6118371330891387,-0.5604763591120505
The disk extends from,$ R=R_\mathrm { in } $,to,R equals R sub in.,1,20,1,1,1,0,2,7.0,1,2.675406433735052,-0.043419990182707376
radius,$ R $,", and the tidal deformability",R,1,3,0,0,0,0,0,0.30000000000000004,0,-1.5320667200554465,-0.01481389381748181
for,"$ i = 1 , \dots , d $",and,"i equals 1, dot dot dot, d.",1,19,1,0,0,0,0,3.9000000000000004,1,0.33482627346474547,-0.27854398634578176
and there exists a solution,$ u $,to,u,1,3,0,0,0,0,0,0.30000000000000004,0,-1.5320667200554465,-0.01481389381748181
one shows that,"$ \psi_ { 1 , \delta } $",is in,Psi sub 1 comma delta.,1,22,2,1,1,0,2,8.2,0,2.920319735622673,0.25339592586734205
Given Drinfeld modules,$ \phi $,and,phi.,1,6,1,0,0,0,0,2.1,0,-0.796550964066675,0.0007333968571364458
write,$ k = 4m + r $,for some integer,k equals 4m plus r.,1,12,0,0,0,0,0,2.2,2,-0.17707652151882203,-0.5761895866343782
the decomposition of the graded character of the tensor product of a level,$ \ell $,Demazure module and a fundamental module into the graded characters of level,lowercase L.,1,6,1,0,0,0,0,2.1,0,-0.796550964066675,0.0007333968571364458
